id,title,designer,notes,description,url,img_url,img_id
7070,Vanilla Summer Lavanila Laboratories for women,lavanila laboratories perfumes and colognes,"['Coconut Milk', 'Sugar Cane', 'Madagascar Vanilla', 'Mango', 'Pineapple']",Vanilla Summer by Lavanila Laboratories is a Amber Vanilla fragrance for women. Vanilla Summer was launched in 2012.,https://www.fragrantica.com/perfume/Lavanila-Laboratories/Vanilla-Summer-61191.html,https://fimgs.net/mdimg/perfume/375x500.61191.jpg,61191
14001,Tous Man Chill Tous for men,tous perfumes and colognes,"['Lime', 'Black Pepper', 'Cardamom', 'Rosemary', 'Lavender', 'Nutmeg', 'Patchouli', 'Vetiver', 'Dry Wood', 'Amber']","Tous Man Chill by Tous is a Aromatic Fruity fragrance for men. This is a new fragrance. Tous Man Chill was launched in 2022. The nose behind this fragrance is Véronique Nyberg. Top notes are Lime, Black Pepper and Cardamom; middle notes are Rosemary, Lavender and Nutmeg; base notes are Patchouli, Vetiver, Dry Wood and Amber.",https://www.fragrantica.com/perfume/Tous/Tous-Man-Chill-73817.html,https://fimgs.net/mdimg/perfume/375x500.73817.jpg,73817
41752,First Love Journal for women and men,journal perfumes and colognes,"['Pear', 'Earl Grey Tea', 'Lavender', 'Lily', 'Rose', 'Rum', 'Benzoin', 'Saffron', 'Olibanum', 'Agarwood (Oud)']","First Love by Journal is a Floral Fruity fragrance for women and men. First Love was launched in 2021. Top notes are Pear, Earl Grey Tea and Lavender; middle notes are Lily, Rose and Rum; base notes are Benzoin, Saffron, Olibanum and Agarwood (Oud).",https://www.fragrantica.com/perfume/Journal/First-Love-69230.html,https://fimgs.net/mdimg/perfume/375x500.69230.jpg,69230
14074,Voile d'Eau Ed Pinaud for women,ed pinaud perfumes and colognes,"['Lemon', 'Mint', 'Hyacinth', 'Jasmine', 'Cedar', 'Amber', 'White Musk']","Voile d'Eau by Ed Pinaud is a Floral fragrance for women. Top notes are Lemon and Mint; middle notes are Hyacinth and Jasmine; base notes are Cedar, Amber and White Musk.",https://www.fragrantica.com/perfume/Ed-Pinaud/Voile-d-Eau-40613.html,https://fimgs.net/mdimg/perfume/375x500.40613.jpg,40613
6975,Squad Capsule Parfums for women and men,capsule parfums perfumes and colognes,"['Leather', 'Citruses', 'Jasmine', 'Vanilla', 'Sandalwood']",Squad by Capsule Parfums is a Leather fragrance for women and men. Squad was launched in 2017.,https://www.fragrantica.com/perfume/Capsule-Parfums/Squad-67859.html,https://fimgs.net/mdimg/perfume/375x500.67859.jpg,67859
39274,Signature Arabian Oud for men,arabian oud perfumes and colognes,"['Cardamom', 'Violet', 'Lemongrass', 'Sage', 'Virginian Cedar', 'Indonesian Patchouli Leaf', 'Crystal Amber', 'Atlas Cedar', 'Musk']","Signature by Arabian Oud is a Woody Spicy fragrance for men. Signature was launched in 2017. Top notes are Cardamom, Violet, Lemongrass and Sage; middle notes are Virginian Cedar and Indonesian Patchouli Leaf; base notes are Crystal Amber, Atlas Cedar and Musk.",https://www.fragrantica.com/perfume/Arabian-Oud/Signature-63059.html,https://fimgs.net/mdimg/perfume/375x500.63059.jpg,63059
3677,Black Infusion Blue Scents for women and men,blue scents perfumes and colognes,"['Bergamot', 'Lemon', 'Green Tea', 'Green Tea Flower', 'Jasmine', 'Peony', 'Cardamom', 'Musk', 'White Cedar Extract', 'Guaiac Wood']","Black Infusion by Blue Scents is a fragrance for women and men. Black Infusion was launched in 2016. Top notes are Bergamot, Lemon and Green Tea; middle notes are Green Tea Flower, Jasmine, Peony and Cardamom; base notes are Musk, White Cedar Extract and Guaiac Wood.",https://www.fragrantica.com/perfume/Blue-Scents/Black-Infusion-49893.html,https://fimgs.net/mdimg/perfume/375x500.49893.jpg,49893
77063,Sheikha Al Battash Concepts for women,al battash concepts perfumes and colognes,"['Agarwood (Oud)', 'Spices', 'Woody Notes', 'Balsamic Vinegar']",Sheikha by Al Battash Concepts is a Woody Spicy fragrance for women.,https://www.fragrantica.com/perfume/Al-Battash-Concepts/Sheikha-34021.html,https://fimgs.net/mdimg/perfume/375x500.34021.jpg,34021
38620,Sandalo Nobile Nobile 1942 for women and men,nobile 1942 perfumes and colognes,"['Saffron', 'Cumin', 'Fig Tree', 'Iris Flower', 'Sandalwood', 'Siam Benzoin', 'Gurjan balsam']","Sandalo Nobile by Nobile 1942 is a Amber Woody fragrance for women and men. Sandalo Nobile was launched in 2016. The nose behind this fragrance is Henri Bergia. Top notes are Saffron and Cumin; middle notes are Fig Tree and Iris Flower; base notes are Sandalwood, Siam Benzoin and Gurjan balsam.",https://www.fragrantica.com/perfume/Nobile-1942/Sandalo-Nobile-35981.html,https://fimgs.net/mdimg/perfume/375x500.35981.jpg,35981
20880,She House of Matriarch for women and men,house of matriarch perfumes and colognes,"['Lemongrass', 'Lemon Verbena', 'Beeswax', 'Lemon Blossom', 'Tonka Bean', 'White Flowers', 'Bergamot', 'Smoke', 'Tea', 'Milk', 'Copal', 'Broom', 'Agarwood (Oud)', 'Tolu Balsam', 'Ambrette (Musk Mallow)', 'Guaiac Wood']","She by House of Matriarch is a fragrance for women and men. She was launched in 2018. The nose behind this fragrance is Christi Meshell. Top notes are Lemongrass, Lemon Verbena, Beeswax, Lemon Blossom, Tonka Bean, White Flowers and Bergamot; middle notes are Smoke, Tea, Milk, Copal and Broom; base notes are Agarwood (Oud), Tolu Balsam, Ambrette (Musk Mallow) and Guaiac Wood.",https://www.fragrantica.com/perfume/House-of-Matriarch/She-48603.html,https://fimgs.net/mdimg/perfume/375x500.48603.jpg,48603
33281,Spirit Of Elegance Al Ambra for women and men,al ambra perfumes and colognes,"['Clary Sage', 'Lavender', 'Leather', 'Bitter Almond', 'Vanilla', 'Orris Root', 'Leather', 'White Woods', 'Tonka Bean', 'Cashmeran', 'Amber']","Spirit Of Elegance by Al Ambra is a Leather fragrance for women and men. Spirit Of Elegance was launched in 2018. The nose behind this fragrance is Ghanim Yaqoob Jumma Khurram. Top notes are Clary Sage and Lavender; middle notes are Leather, Bitter Almond, Vanilla and Orris Root; base notes are Leather, White Woods, Tonka Bean, Cashmeran and Amber.",https://www.fragrantica.com/perfume/Al-Ambra/Spirit-Of-Elegance-52543.html,https://fimgs.net/mdimg/perfume/375x500.52543.jpg,52543
74447,Falling in Leaves Atkinsons for women and men,atkinsons perfumes and colognes,"['Plum', 'Rhubarb', 'Black Tea', 'Rose', 'Patchouli', 'Saffron', 'Peony', 'Vanilla', 'Sandalwood']","Falling in Leaves by Atkinsons is a Amber Woody fragrance for women and men. Falling in Leaves was launched in 2017. Top notes are Plum, Rhubarb and Black Tea; middle notes are Rose, Patchouli, Saffron and Peony; base notes are Vanilla and Sandalwood.",https://www.fragrantica.com/perfume/Atkinsons/Falling-in-Leaves-46960.html,https://fimgs.net/mdimg/perfume/375x500.46960.jpg,46960
69346,Jasmin Reflexion for women,reflexion perfumes and colognes,"['Jasmine', 'Strawberry', 'Jasmine', 'Jasmine', 'Benzoin']",Jasmin by Reflexion is a Floral fragrance for women. The nose behind this fragrance is Eugene Firsanov. Top notes are Jasmine and Strawberry; middle note is Jasmine; base notes are Jasmine and Benzoin.,https://www.fragrantica.com/perfume/Reflexion/Jasmin-48043.html,https://fimgs.net/mdimg/perfume/375x500.48043.jpg,48043
546,Sultão Flora Pura for men,flora pura perfumes and colognes,"['Incense', 'Rose', 'Bergamot', 'Pink Pepper', 'elemi', 'Nutmeg', 'Jasmine', 'Musk', 'Amber', 'Patchouli']","Sultão by Flora Pura is a Amber Floral fragrance for men. Sultão was launched in 2019. The nose behind this fragrance is Edison Fujita. Top notes are Incense, Rose, Bergamot and Pink Pepper; middle notes are elemi, Nutmeg and Jasmine; base notes are Musk, Amber and Patchouli.",https://www.fragrantica.com/perfume/Flora-Pura/Sultao-73482.html,https://fimgs.net/mdimg/perfume/375x500.73482.jpg,73482
23931,Royal Player Arno Sorel for men,arno sorel perfumes and colognes,"['Citruses', 'Cedar', 'Cinnamon', 'Patchouli', 'Amber']",Royal Player by Arno Sorel is a Amber Woody fragrance for men. Royal Player was launched in 2018. Top note is Citruses; middle notes are Cedar and Cinnamon; base notes are Patchouli and Amber.,https://www.fragrantica.com/perfume/Arno-Sorel/Royal-Player-51909.html,https://fimgs.net/mdimg/perfume/375x500.51909.jpg,51909
69594,Attar Kaba Official Scent Salim for women and men,scent salim perfumes and colognes,"['Jasmine', 'Taif Rose', 'Agarwood (Oud)', 'Musk', 'Amber', 'Saffron']",Attar Kaba Official by Scent Salim is a fragrance for women and men. Attar Kaba Official was launched during the 2010's. The nose behind this fragrance is Ilyas Salim. Top notes are Jasmine and Taif Rose; middle notes are Agarwood (Oud) and Musk; base notes are Amber and Saffron.,https://www.fragrantica.com/perfume/Scent-Salim/Attar-Kaba-Official-47962.html,https://fimgs.net/mdimg/perfume/375x500.47962.jpg,47962
38255,Sweet Leather Odetu for women and men,odetu perfumes and colognes,"['Plum', 'Cinnamon', 'Lemon', 'Bergamot', 'Suede', 'Osmanthus', 'Peach', 'Patchouli', 'Leather', 'Civet', 'Musk', 'Saffron', 'Vanilla']","Sweet Leather by Odetu is a Leather fragrance for women and men. Sweet Leather was launched in 2020. The nose behind this fragrance is Andrey Chibisov. Top notes are Plum, Cinnamon, Lemon and Bergamot; middle notes are Suede, Osmanthus, Peach and Patchouli; base notes are Leather, Civet, Musk, Saffron and Vanilla.",https://www.fragrantica.com/perfume/Odetu/Sweet-Leather-65483.html,https://fimgs.net/mdimg/perfume/375x500.65483.jpg,65483
37179,Homem Sagaz Natura for men,natura perfumes and colognes,"['Green Mandarin', 'Sage', 'Lemon Balm', 'Cypress', 'Plum', 'Black Pepper', 'Nutmeg', 'Amber', 'Sandalwood', 'Cedar', 'Vanilla', 'Tonka Bean']","Homem Sagaz by Natura is a Aromatic Spicy fragrance for men. Homem Sagaz was launched in 2017. Homem Sagaz was created by Verônica Kato and Antoine Maisondieu. Top notes are Green Mandarin, Sage, Lemon Balm and Cypress; middle notes are Plum, Black Pepper and Nutmeg; base notes are Amber, Sandalwood, Cedar, Vanilla and Tonka Bean.",https://www.fragrantica.com/perfume/Natura/Homem-Sagaz-48965.html,https://fimgs.net/mdimg/perfume/375x500.48965.jpg,48965
57585,Grand Palais Al-Jazeera Perfumes for women and men,al-jazeera perfumes perfumes and colognes,"['Mandarin Orange', 'Pink Pepper', 'Red Currant', 'Osmanthus', 'Gardenia', 'Jasmine', 'Sandalwood', 'Patchouli', 'Vanilla']","Grand Palais by Al-Jazeera Perfumes is a Amber Floral fragrance for women and men. Grand Palais was launched in 2018. The nose behind this fragrance is Dominique Ropion. Top notes are Mandarin Orange, Pink Pepper and Red Currant; middle notes are Osmanthus, Gardenia and Jasmine; base notes are Sandalwood, Patchouli and Vanilla.",https://www.fragrantica.com/perfume/Al-Jazeera-Perfumes/Grand-Palais-74379.html,https://fimgs.net/mdimg/perfume/375x500.74379.jpg,74379
69859,Nuvola di Crema Olfattiva for women and men,olfattiva perfumes and colognes,"['Lemon', 'Vanilla']",Nuvola di Crema by Olfattiva is a fragrance for women and men. Top note is Lemon; base note is Vanilla.,https://www.fragrantica.com/perfume/Olfattiva/Nuvola-di-Crema-72103.html,https://fimgs.net/mdimg/perfume/375x500.72103.jpg,72103
3267,Mimosa In The Air Veronique Gabai for women and men,veronique gabai perfumes and colognes,"['Mimosa', 'Vetiver']",Mimosa In The Air by Veronique Gabai is a Floral fragrance for women and men. Mimosa In The Air was launched in 2019.,https://www.fragrantica.com/perfume/Veronique-Gabai/Mimosa-In-The-Air-60669.html,https://fimgs.net/mdimg/perfume/375x500.60669.jpg,60669
20380,Bois Impérial Essential Parfums for women and men,essential parfums perfumes and colognes,"['Akigalawood', 'Woodsy Notes', 'Vetiver', 'Basil', 'Timur', 'Ambroxan', 'Patchouli']",Bois Impérial by Essential Parfums is a Aromatic fragrance for women and men. Bois Impérial was launched in 2020. The nose behind this fragrance is Quentin Bisch.,https://www.fragrantica.com/perfume/Essential-Parfums/Bois-Imperial-64338.html,https://fimgs.net/mdimg/perfume/375x500.64338.jpg,64338
38554,Boss The Scent Absolute Hugo Boss for men,hugo boss perfumes and colognes,"['Ginger', 'Maninka', 'Vetiver']",Boss The Scent Absolute by Hugo Boss is a Amber Spicy fragrance for men. Boss The Scent Absolute was launched in 2019. The nose behind this fragrance is Bruno Jovanovic. Top note is Ginger; middle note is Maninka; base note is Vetiver.,https://www.fragrantica.com/perfume/Hugo-Boss/Boss-The-Scent-Absolute-56295.html,https://fimgs.net/mdimg/perfume/375x500.56295.jpg,56295
78630,TOUS MAN Les Colognes Concentrées Tous for men,tous perfumes and colognes,"['Grapefruit', 'Orange Blossom', 'Guaiac Wood', 'Mint', 'Vetiver', 'Tonka Bean']",TOUS MAN Les Colognes Concentrées by Tous is a Woody Aromatic fragrance for men. TOUS MAN Les Colognes Concentrées was launched in 2016. The nose behind this fragrance is Benoist Lapouza. Top notes are Grapefruit and Orange Blossom; middle notes are Guaiac Wood and Mint; base notes are Vetiver and Tonka Bean.,https://www.fragrantica.com/perfume/Tous/TOUS-MAN-Les-Colognes-Concentrees-38372.html,https://fimgs.net/mdimg/perfume/375x500.38372.jpg,38372
33805,Fleur Blanche Alexandria Fragrances for women and men,alexandria fragrances perfumes and colognes,"['Lily', 'Sichuan Pepper', 'Jasmine', 'Tuberose', 'Cacao', 'Benzoin', 'Styrax', 'Suede', 'Agarwood (Oud)', 'Tonka Bean', 'Musk']","Fleur Blanche by Alexandria Fragrances is a Aromatic Spicy fragrance for women and men. Fleur Blanche was launched in 2021. Top notes are Lily, Sichuan Pepper and Jasmine; middle notes are Tuberose, Cacao, Benzoin and Styrax; base notes are Suede, Agarwood (Oud), Tonka Bean and Musk.",https://www.fragrantica.com/perfume/Alexandria-Fragrances/Fleur-Blanche-68446.html,https://fimgs.net/mdimg/perfume/375x500.68446.jpg,68446
43576,Coffee Break Requin for women and men,requin perfumes and colognes,"['Peru Balsam', 'Chocolate', 'Coffee', 'Chocolate', 'Pink Pepper', 'Amber', 'Vanilla', 'Patchouli']","Coffee Break by Requin is a Amber Vanilla fragrance for women and men. Coffee Break was launched in 2017. The nose behind this fragrance is Sérgio Eduardo Reis. Top notes are Peru Balsam and Chocolate; middle notes are Coffee, Chocolate and Pink Pepper; base notes are Amber, Vanilla and Patchouli.",https://www.fragrantica.com/perfume/Requin/Coffee-Break-56193.html,https://fimgs.net/mdimg/perfume/375x500.56193.jpg,56193
16910,Potion Lush for women,lush perfumes and colognes,"['Carnation', 'Tangerine', 'Rose', 'Almond']",Potion by Lush is a fragrance for women. Potion was launched in 2005.,https://www.fragrantica.com/perfume/Lush/Potion-63325.html,https://fimgs.net/mdimg/perfume/375x500.63325.jpg,63325
14103,Kahwa Boadicea the Victorious for women and men,boadicea the victorious perfumes and colognes,"['Cardamom', 'Bay Leaf', 'Eucalyptus', 'Ginger', 'Saffron', 'Clove', 'Coffee', 'Jasmine Sambac', 'Bulgarian Rose', 'Neroli', 'Amber', 'Cambodian Oud', 'Cedar', 'Oakmoss', 'Patchouli']","Kahwa by Boadicea the Victorious is a Aromatic Green fragrance for women and men. Kahwa was launched in 2021. The nose behind this fragrance is Christian Provenzano. Top notes are Cardamom, Bay Leaf, Eucalyptus, Ginger, Saffron and Clove; middle notes are Coffee, Jasmine Sambac, Bulgarian Rose and Neroli; base notes are Amber, Cambodian Oud, Cedar, Oakmoss and Patchouli.",https://www.fragrantica.com/perfume/Boadicea-the-Victorious/Kahwa-69005.html,https://fimgs.net/mdimg/perfume/375x500.69005.jpg,69005
73365,Marbella Al-Jazeera Perfumes for women and men,al-jazeera perfumes perfumes and colognes,"['Bergamot', 'Pear', 'Red Fruits', 'Rose', 'Jasmine', 'Violet', 'Patchouli', 'Vanilla', 'Tonka Bean']","Marbella by Al-Jazeera Perfumes is a Amber Floral fragrance for women and men. Marbella was launched in 2021. The nose behind this fragrance is Fanny Bal. Top notes are Bergamot, Pear and Red Fruits; middle notes are Rose, Jasmine and Violet; base notes are Patchouli, Vanilla and Tonka Bean.",https://www.fragrantica.com/perfume/Al-Jazeera-Perfumes/Marbella-74386.html,https://fimgs.net/mdimg/perfume/375x500.74386.jpg,74386
61512,Water Ivy Brocard for women,brocard perfumes and colognes,"['Watery Notes', 'Peach', 'Bergamot', 'Ivy', 'Bellflower', 'Peony', 'Jasmine', 'White Musk', 'Moss']","Water Ivy by Brocard is a Floral Aquatic fragrance for women. Water Ivy was launched in 2021. The nose behind this fragrance is Patrice Martin. Top notes are Watery Notes, Peach and Bergamot; middle notes are Ivy, Bellflower, Peony and Jasmine; base notes are White Musk and Moss.",https://www.fragrantica.com/perfume/Brocard/Water-Ivy-80112.html,https://fimgs.net/mdimg/perfume/375x500.80112.jpg,80112
22332,Dua’s Fantasy The Dua Brand for women and men,the dua brand perfumes and colognes,"['Cherry Blossom', 'Heliotrope', 'White Musk', 'Pink Peony', 'Raspberry', 'Vanilla', 'Freesia', 'Praline', 'Peach', 'Sugar', 'Pear', 'Lime']",Dua’s Fantasy by The Dua Brand is a fragrance for women and men. Dua’s Fantasy was launched in 2021.,https://www.fragrantica.com/perfume/The-Dua-Brand/Dua-s-Fantasy-80790.html,https://fimgs.net/mdimg/perfume/375x500.80790.jpg,80790
76194,White Leather Zoha Aroma for women and men,zoha aroma perfumes and colognes,"['Tobacco', 'Chocolate', 'Whiskey', 'Amber', 'Leather', 'Vanilla', 'Agarwood (Oud)']",White Leather by Zoha Aroma is a Leather fragrance for women and men. White Leather was launched in 2019.,https://www.fragrantica.com/perfume/Zoha-Aroma/White-Leather-61552.html,https://fimgs.net/mdimg/perfume/375x500.61552.jpg,61552
62492,Sacred Sound – Patakwin Invocation for women and men,invocation perfumes and colognes,"['Rosemary', 'Tea', 'Lemon', 'Mint', 'Eucalyptus', 'Spruce']",Sacred Sound – Patakwin by Invocation is a Aromatic Green fragrance for women and men. Sacred Sound – Patakwin was launched in 2018.,https://www.fragrantica.com/perfume/Invocation/Sacred-Sound-Patakwin-52478.html,https://fimgs.net/mdimg/perfume/375x500.52478.jpg,52478
57146,Baiser de Florence Ella K Parfums for women and men,ella k parfums perfumes and colognes,"['Olibanum', 'Myrrh', 'Iris', 'Heliotrope', 'Vanilla', 'Musk', 'Jasmine']",Baiser de Florence by Ella K Parfums is a Floral Woody Musk fragrance for women and men. Baiser de Florence was launched in 2018. The nose behind this fragrance is Sonia Constant.,https://www.fragrantica.com/perfume/Ella-K-Parfums/Baiser-de-Florence-48469.html,https://fimgs.net/mdimg/perfume/375x500.48469.jpg,48469
28258,Kar.ribe 04 Kar.ribe for women,kar.ribe perfumes and colognes,"['Peach', 'Black Currant', 'Neroli', 'Rose', 'Orange Blossom', 'Sage', 'Sandalwood', 'Vanilla', 'Patchouli']","Kar.ribe 04 by Kar.ribe is a Floral Fruity fragrance for women. Kar.ribe 04 was launched in 2018. Top notes are Peach, Black Currant and Neroli; middle notes are Rose, Orange Blossom and Sage; base notes are Sandalwood, Vanilla and Patchouli.",https://www.fragrantica.com/perfume/Kar-ribe/Kar-ribe-04-52297.html,https://fimgs.net/mdimg/perfume/375x500.52297.jpg,52297
59135,Zephyr Samy Andraus Fragrances for women and men,samy andraus fragrances perfumes and colognes,"['Lemon', 'Saffron', 'Sage', 'Jasmine', 'Rose', 'Agarwood (Oud)', 'Amber']","Zephyr by Samy Andraus Fragrances is a Aromatic fragrance for women and men. Zephyr was launched in 2019. Top notes are Lemon, Saffron and Sage; middle notes are Jasmine and Rose; base notes are Agarwood (Oud) and Amber.",https://www.fragrantica.com/perfume/Samy-Andraus-Fragrances/Zephyr-58012.html,https://fimgs.net/mdimg/perfume/375x500.58012.jpg,58012
76664,Quasar Quest O Boticário for men,o boticário perfumes and colognes,"['Water Notes', 'Tangerine', 'Bergamot', 'Pepper', 'Geranium', 'Juniper', 'Cedar', 'Musk', 'Vetiver', 'Amber', 'Sandalwood']","Quasar Quest by O Boticário is a Aromatic Fougere fragrance for men. Quasar Quest was launched in 2013. The nose behind this fragrance is Verônica Casanova. Top notes are Water Notes, Tangerine, Bergamot and Pepper; middle notes are Geranium, Juniper and Cedar; base notes are Musk, Vetiver, Amber and Sandalwood.",https://www.fragrantica.com/perfume/O-Boticario/Quasar-Quest-33914.html,https://fimgs.net/mdimg/perfume/375x500.33914.jpg,33914
34,Ginger Mentha No. 1319 C.O.Bigelow for women and men,c.o.bigelow perfumes and colognes,"['Ginger', 'Mint', 'Sandalwood']",Ginger Mentha No. 1319 by C.O.Bigelow is a Aromatic fragrance for women and men. Ginger Mentha No. 1319 was launched in 2009.,https://www.fragrantica.com/perfume/C-O-Bigelow/Ginger-Mentha-No-1319-45812.html,https://fimgs.net/mdimg/perfume/375x500.45812.jpg,45812
1455,F*ck Mondays Confessions of A Rebel for women and men,confessions of a rebel perfumes and colognes,"['Bergamot', 'Apple', 'Peach', 'Clary Sage', 'Musk', 'Sandalwood', 'Suede']",F*ck Mondays by Confessions of A Rebel is a Floral Woody Musk fragrance for women and men. F*ck Mondays was launched in 2020.,https://www.fragrantica.com/perfume/Confessions-of-A-Rebel/F-ck-Mondays-67380.html,https://fimgs.net/mdimg/perfume/375x500.67380.jpg,67380
56283,Naomi Sapientiae Niche for women and men,sapientiae niche perfumes and colognes,"['Vanilla Flower', 'Tuberose', 'Mandarin Orange', 'Sandalowood', 'Green Tea', 'Caramel', 'Saffron', 'Benzoin', 'Lotus']","Naomi by Sapientiae Niche is a Amber fragrance for women and men. Naomi was launched in 2018. The nose behind this fragrance is Sanderson Santana. Top notes are Vanilla Flower, Tuberose and Mandarin Orange; middle notes are Sandalowood and Green Tea; base notes are Caramel, Saffron, Benzoin and Lotus.",https://www.fragrantica.com/perfume/Sapientiae-Niche/Naomi-57275.html,https://fimgs.net/mdimg/perfume/375x500.57275.jpg,57275
60232,Gi-Gi May Fair Le Caire for women,may fair le caire perfumes and colognes,"['Bitter Orange', 'Aldehydes', 'Tangerine', 'Galbanum', 'Bergamot', 'Lemon Balm', 'Mint', 'Lime', 'Lily-of-the-Valley', 'Ylang-Ylang', 'Orange Blossom', 'Jasmine', 'Honey', 'Rose', 'Tea', 'Clove', 'Narcissus', 'Tarragon', 'Resins', 'Oakmoss', 'Sandalwood', 'Labdanum', 'Musk', 'Vetiver', 'Vanilla', 'Cedar', 'Amber', 'Patchouli']","Gi-Gi by May Fair Le Caire is a Floral Green fragrance for women. Gi-Gi was launched during the 1970's. Top notes are Bitter Orange, Aldehydes, Tangerine, Galbanum, Bergamot, Lemon Balm, Mint and Lime; middle notes are Lily-of-the-Valley, Ylang-Ylang, Orange Blossom, Jasmine, Honey, Rose, Tea, Clove, Narcissus and Tarragon; base notes are Resins, Oakmoss, Sandalwood, Labdanum, Musk, Vetiver, Vanilla, Cedar, Amber and Patchouli.",https://www.fragrantica.com/perfume/May-Fair-Le-Caire/Gi-Gi-37068.html,https://fimgs.net/mdimg/perfume/375x500.37068.jpg,37068
4056,Woody Rose Yntenzo for women and men,yntenzo perfumes and colognes,"['Rose', 'Honey', 'Clove', 'Sandalwood', 'Cedar', 'Jasmine', 'Patchouli', 'Sugar', 'Musk', 'Woody Notes']","Woody Rose by Yntenzo is a Floral Woody Musk fragrance for women and men. Woody Rose was launched in 2018. Top notes are Rose, Honey and Clove; middle notes are Sandalwood, Cedar, Jasmine and Patchouli; base notes are Sugar, Musk and Woody Notes.",https://www.fragrantica.com/perfume/Yntenzo/Woody-Rose-53449.html,https://fimgs.net/mdimg/perfume/375x500.53449.jpg,53449
8270,Bourbon Amber Cologne Intense The Art Of Shaving for men,the art of shaving perfumes and colognes,"['Cypriol Oil or Nagarmotha', 'Italian Lemon', 'Vanilla', 'Lavender', 'Saffron', 'Amber', 'Sandalwood', 'Patchouli', 'Labdanum']","Bourbon Amber Cologne Intense by The Art Of Shaving is a Amber fragrance for men. Bourbon Amber Cologne Intense was launched in 2018. Top notes are Cypriol Oil or Nagarmotha and Italian Lemon; middle notes are Vanilla, Lavender and Saffron; base notes are Amber, Sandalwood, Patchouli and Labdanum.",https://www.fragrantica.com/perfume/The-Art-Of-Shaving/Bourbon-Amber-Cologne-Intense-52385.html,https://fimgs.net/mdimg/perfume/375x500.52385.jpg,52385
61765,Mademoiselle N. 13 Parfums Constantine for women,parfums constantine perfumes and colognes,"['Bamboo', 'Pear', 'Lotus', 'Tea', 'Cassis', 'Guaiac Wood', 'Musk', 'Oakmoss']","Mademoiselle N. 13 by Parfums Constantine is a Floral Aquatic fragrance for women. Mademoiselle N. 13 was launched in 2021. Top notes are Bamboo and Pear; middle notes are Lotus, Tea and Cassis; base notes are Guaiac Wood, Musk and Oakmoss.",https://www.fragrantica.com/perfume/Parfums-Constantine/Mademoiselle-N-13-71561.html,https://fimgs.net/mdimg/perfume/375x500.71561.jpg,71561
40791,Attractive Supreme Água de Cheiro for men,água de cheiro perfumes and colognes,"['Sicilian Lemon', 'Cardamom', 'Sandalwood']",Attractive Supreme by Água de Cheiro is a Woody Aromatic fragrance for men. This is a new fragrance. Attractive Supreme was launched in 2022. The nose behind this fragrance is Edison Fujita. Top note is Sicilian Lemon; middle note is Cardamom; base note is Sandalwood.,https://www.fragrantica.com/perfume/Agua-de-Cheiro/Attractive-Supreme-75142.html,https://fimgs.net/mdimg/perfume/375x500.75142.jpg,75142
23944,Cocoa Kisses Sweet Essentials for women and men,sweet essentials perfumes and colognes,"['Cacao Pod', 'Vanilla', 'Strawberry', 'Coconut', 'Chocolate', 'Sugar', 'Oily Notes']",Cocoa Kisses by Sweet Essentials is a Amber Vanilla fragrance for women and men. Cocoa Kisses was launched in 2017.,https://www.fragrantica.com/perfume/Sweet-Essentials/Cocoa-Kisses-59871.html,https://fimgs.net/mdimg/perfume/375x500.59871.jpg,59871
76969,American Pharoah Folkwinds for women and men,folkwinds perfumes and colognes,"['Cherry', 'Ambrette (Musk Mallow)', 'Tobacco', 'Virginia Cedar', 'Mexican Vanilla', 'Ambergris', 'Sandalwood', 'Natural Musk', 'Muskrat', 'Damask Rose', 'Carolina Reaper']",American Pharoah by Folkwinds is a fragrance for women and men. This is a new fragrance. American Pharoah was launched in 2022. The nose behind this fragrance is Jono Bornstein.,https://www.fragrantica.com/perfume/Folkwinds/American-Pharoah-77159.html,https://fimgs.net/mdimg/perfume/375x500.77159.jpg,77159
