id,title,designer,notes,description,url,img_url,img_id
62176,Organza Gold Collection (10 Years Anniversary Limited Edition) Givenchy for women,givenchy perfumes and colognes,"['Tuberose', 'Ylang-Ylang', 'Jasmine', 'Honeysuckle', 'Vanilla', 'Amber', 'Sandalwood', 'Cedar']","Organza Gold Collection (10 Years Anniversary Limited Edition) by Givenchy is a fragrance for women. Organza Gold Collection (10 Years Anniversary Limited Edition) was launched in 2006. The nose behind this fragrance is Sophie Labbe. Top notes are Tuberose and Ylang-Ylang; middle notes are Jasmine and Honeysuckle; base notes are Vanilla, Amber, Sandalwood and Cedar.",https://www.fragrantica.com/perfume/Givenchy/Organza-Gold-Collection-10-Years-Anniversary-Limited-Edition-40467.html,https://fimgs.net/mdimg/perfume/375x500.40467.jpg,40467
21253,Idols Oud S''Ram for women and men,s''ram perfumes and colognes,"['Lady of the Night Flower', 'Pineapple', 'Fruity Notes', 'Ylang-Ylang', 'Jasmine', 'White Flowers', 'Amyl Salicylate', 'Orange Blossom', 'Vanilla', 'Agarwood (Oud)', 'Musk']","Idols Oud by S''Ram is a Amber Woody fragrance for women and men. Idols Oud was launched in 2021. Top notes are Lady of the Night Flower, Pineapple, Fruity Notes and Ylang-Ylang; middle notes are Jasmine, White Flowers, Amyl Salicylate and Orange Blossom; base notes are Vanilla, Agarwood (Oud) and Musk.",https://www.fragrantica.com/perfume/S-Ram/Idols-Oud-71090.html,https://fimgs.net/mdimg/perfume/375x500.71090.jpg,71090
6622,Demi-Lune № 6 CIEL Parfum for men,ciel parfum perfumes and colognes,"['Rosemary', 'Bergamot', 'Nutmeg', 'White Pepper', 'Cashmere Wood', 'Oakmoss', 'Iris']","Demi-Lune № 6 by CIEL Parfum is a Woody fragrance for men. Top notes are Rosemary and Bergamot; middle notes are Nutmeg and White Pepper; base notes are Cashmere Wood, Oakmoss and Iris.",https://www.fragrantica.com/perfume/CIEL-Parfum/Demi-Lune-6-34179.html,https://fimgs.net/mdimg/perfume/375x500.34179.jpg,34179
34244,Vibrant Spirit Zara for women,zara perfumes and colognes,"['Mandarin Orange', 'Ylang-Ylang', 'Ambroxan']",Vibrant Spirit by Zara is a Amber Floral fragrance for women. Vibrant Spirit was launched in 2021. Top note is Mandarin Orange; middle note is Ylang-Ylang; base note is Ambroxan.,https://www.fragrantica.com/perfume/Zara/Vibrant-Spirit-66924.html,https://fimgs.net/mdimg/perfume/375x500.66924.jpg,66924
16639,Evoke for Him Ajmal for men,ajmal perfumes and colognes,"['Lavender', 'Green Apple', 'Bergamot', 'Cardamom', 'Orris', 'Heliotrope', 'Juniper', 'Sandalwood', 'Musk', 'Vetiver']","Evoke for Him by Ajmal is a Aromatic fragrance for men. Top notes are Lavender, Green Apple and Bergamot; middle notes are Cardamom, Orris, Heliotrope and Juniper; base notes are Sandalwood, Musk and Vetiver.",https://www.fragrantica.com/perfume/Ajmal/Evoke-for-Him-32527.html,https://fimgs.net/mdimg/perfume/375x500.32527.jpg,32527
7366,Emanuel Ungaro Fresh For Her Emanuel Ungaro for women,emanuel ungaro perfumes and colognes,"['Nashi Pear', 'Bergamot', 'Citron', 'Jasmine', 'Peony', 'Lily-of-the-Valley', 'Tonka Bean', 'Patchouli', 'Sandalwood']","Emanuel Ungaro Fresh For Her by Emanuel Ungaro is a Amber Floral fragrance for women. Emanuel Ungaro Fresh For Her was launched in 2020. Top notes are Nashi Pear, Bergamot and Citron; middle notes are Jasmine, Peony and Lily-of-the-Valley; base notes are Tonka Bean, Patchouli and Sandalwood.",https://www.fragrantica.com/perfume/Emanuel-Ungaro/Emanuel-Ungaro-Fresh-For-Her-61860.html,https://fimgs.net/mdimg/perfume/375x500.61860.jpg,61860
23044,Shield-Maiden Poesie for women and men,poesie perfumes and colognes,"['Pink Rose', 'Pine', 'Peony', 'Metallic notes', 'Earthy Notes', 'Mountain Air']",Shield-Maiden by Poesie is a fragrance for women and men. Shield-Maiden was launched in 2017. The nose behind this fragrance is Joelle Nealy.,https://www.fragrantica.com/perfume/Poesie/Shield-Maiden-54249.html,https://fimgs.net/mdimg/perfume/375x500.54249.jpg,54249
43790,Louve Prima Materia for women,prima materia perfumes and colognes,"['Grapefruit', 'Mandarin Orange', 'Pear', 'Exotic Fruits', 'White Flowers', 'Tuberose', 'Musk', 'Amberwood', 'Sandalwood']","Louve by Prima Materia is a fragrance for women. Louve was launched in 2021. The nose behind this fragrance is Gerard Anthony. Top notes are Grapefruit, Mandarin Orange and Pear; middle notes are Exotic Fruits, White Flowers and Tuberose; base notes are Musk, Amberwood and Sandalwood.",https://www.fragrantica.com/perfume/Prima-Materia/Louve-67475.html,https://fimgs.net/mdimg/perfume/375x500.67475.jpg,67475
49374,Ottoman Empire III Areej Le Doré for women and men,areej le doré perfumes and colognes,"['Rose', 'Bulgarian Rose', 'Rose Oil', 'White Rose', 'Pepper', 'Cardamom', 'Frangipani', 'Jasmine', 'Agarwood (Oud)', 'Indian Oud', 'Frangipani', 'Saffron', 'Nutmeg', 'Vetiver', 'Myrrh', 'Amber', 'Sandalwood', 'Oakmoss']","Ottoman Empire III by Areej Le Doré is a Amber Floral fragrance for women and men. Ottoman Empire III was launched in 2021. The nose behind this fragrance is Russian Adam. Top notes are Rose, Bulgarian Rose, Rose Oil, White Rose, Pepper, Cardamom, Frangipani and Jasmine; middle notes are Agarwood (Oud), Indian Oud, Frangipani, Saffron, Nutmeg and Vetiver; base notes are Myrrh, Amber, Sandalwood and Oakmoss.",https://www.fragrantica.com/perfume/Areej-Le-Dore/Ottoman-Empire-III-67898.html,https://fimgs.net/mdimg/perfume/375x500.67898.jpg,67898
36315,Bûche de Noël (Рождественское Полено) Odoratika for women,odoratika perfumes and colognes,"['Amaretto', 'Chocolate', 'Vanilla', 'Coffee', 'Heliotrope', 'Cacao Pod', 'French pastries', 'Sandalwood', 'Tonka Bean', 'Cinnamon', 'Amber', 'Musk']",Bûche de Noël (Рождественское Полено) by Odoratika is a Amber Vanilla fragrance for women. Bûche de Noël (Рождественское Полено) was launched in 2018.,https://www.fragrantica.com/perfume/Odoratika/Buche-de-Noel-Rozdestvenskoe-Poleno-51139.html,https://fimgs.net/mdimg/perfume/375x500.51139.jpg,51139
32946,Sandalwood Vanilla Perfume Oil Scent by the Sea for women and men,scent by the sea perfumes and colognes,"['Sandalwood', 'Musk', 'Woody Notes', 'Vanilla']",Sandalwood Vanilla Perfume Oil by Scent by the Sea is a Woody Aromatic fragrance for women and men.,https://www.fragrantica.com/perfume/Scent-by-the-Sea/Sandalwood-Vanilla-Perfume-Oil-33856.html,https://fimgs.net/mdimg/perfume/375x500.33856.jpg,33856
16288,Guardian Solstice Scents for women and men,solstice scents perfumes and colognes,"['Sage', 'Clary Sage', 'Shiso', 'Spruce', 'Bergamot', 'Pine', 'Balsam Fir', 'Patchouli', 'Amber', 'Cypress', 'Nard Himalayan (Jatamansi)', 'Haitian Vetiver', 'Juniper', 'Muhuhu', 'Sandalwood', 'Agarwood (Oud)', 'Mushroom', 'Oakmoss']","Guardian by Solstice Scents is a Woody Chypre fragrance for women and men. Guardian was launched in 2018. The nose behind this fragrance is Angela St.John. Top notes are Sage, Clary Sage, Shiso, Spruce and Bergamot; middle notes are Pine and Balsam Fir; base notes are Patchouli, Amber, Cypress, Nard Himalayan (Jatamansi), Haitian Vetiver, Juniper, Muhuhu, Sandalwood, Agarwood (Oud), Mushroom and Oakmoss.",https://www.fragrantica.com/perfume/Solstice-Scents/Guardian-52955.html,https://fimgs.net/mdimg/perfume/375x500.52955.jpg,52955
48400,Anni di Ricordi Ricordi for women and men,ricordi perfumes and colognes,"['Black Currant', 'Jasmine', 'Incense', 'Cyclamen', 'Patchouli', 'Bulgarian Rose', 'Labdanum', 'Narcissus', 'Moss', 'Amber']","Anni di Ricordi by Ricordi is a Amber Floral fragrance for women and men. This is a new fragrance. Anni di Ricordi was launched in 2022. Top notes are Black Currant, Jasmine and Incense; middle notes are Cyclamen, Patchouli, Bulgarian Rose and Labdanum; base notes are Narcissus, Moss and Amber.",https://www.fragrantica.com/perfume/Ricordi/Anni-di-Ricordi-80016.html,https://fimgs.net/mdimg/perfume/375x500.80016.jpg,80016
8611,In Love The Fragrance Kitchen for women and men,the fragrance kitchen perfumes and colognes,"['Citron', 'Pink Pepper', 'Orange', 'Bergamot', 'Cedar', 'Apple', 'Jasmine', 'Guaiac Wood', 'Amber', 'Sandalwood', 'Patchouli']","In Love by The Fragrance Kitchen is a Amber Floral fragrance for women and men. In Love was launched in 2015. The nose behind this fragrance is Chris Maurice. Top notes are Citron, Pink Pepper, Orange and Bergamot; middle notes are Cedar, Apple and Jasmine; base notes are Guaiac Wood, Amber, Sandalwood and Patchouli.",https://www.fragrantica.com/perfume/The-Fragrance-Kitchen/In-Love-37769.html,https://fimgs.net/mdimg/perfume/375x500.37769.jpg,37769
34189,Berries Flowers Wood - Bacche Fiori Legni L'Erbolario for women and men,l'erbolario perfumes and colognes,"['Hawthorn', 'Grapefruit', 'Orange Blossom', 'Cardamom', 'Cedar', 'Labdanum']","Berries Flowers Wood - Bacche Fiori Legni by L'Erbolario is a fragrance for women and men. Berries Flowers Wood - Bacche Fiori Legni was launched in 2021. Top notes are Hawthorn, Grapefruit and Orange Blossom; middle note is Cardamom; base notes are Cedar and Labdanum.",https://www.fragrantica.com/perfume/L-Erbolario/Berries-Flowers-Wood-Bacche-Fiori-Legni-70086.html,https://fimgs.net/mdimg/perfume/375x500.70086.jpg,70086
53943,Pelle d'Angelo NonPlusUltra Parfum for women and men,nonplusultra parfum perfumes and colognes,"['Lime', 'Bergamot', 'Red Berries', 'Black Pepper', 'Violet', 'Peach', 'Rose', 'Jasmine', 'Orris', 'Cedar', 'Musk', 'Amber', 'Elemi resin']","Pelle d'Angelo by NonPlusUltra Parfum is a Floral Fruity fragrance for women and men. Pelle d'Angelo was launched in 2021. Top notes are Lime, Bergamot, Red Berries and Black Pepper; middle notes are Violet, Peach, Rose, Jasmine and Orris; base notes are Cedar, Musk, Amber and Elemi resin.",https://www.fragrantica.com/perfume/NonPlusUltra-Parfum/Pelle-d-Angelo-72356.html,https://fimgs.net/mdimg/perfume/375x500.72356.jpg,72356
38199,N.124 InEstasy for women,inestasy perfumes and colognes,"['Orange Blossom', 'Bitter Almond', 'Coffee', 'Licorice', 'Vanilla', 'Patchouli']",N.124 by InEstasy is a fragrance for women.,https://www.fragrantica.com/perfume/InEstasy/N-124-58933.html,https://fimgs.net/mdimg/perfume/375x500.58933.jpg,58933
1704,R Avery for women and men,avery perfumes and colognes,"['Mandarin Orange', 'Sea Notes', 'Mint', 'Sage', 'Oregano', 'Basil', 'Balsam Fir', 'oak moss', 'Sandalwood']","R by Avery is a Citrus Aromatic fragrance for women and men. R was launched in 2017. The nose behind this fragrance is Celso Fadelli. Top notes are Mandarin Orange, Sea Notes and Mint; middle notes are Sage, Oregano and Basil; base notes are Balsam Fir, oak moss and Sandalwood.",https://www.fragrantica.com/perfume/Avery/R-48877.html,https://fimgs.net/mdimg/perfume/375x500.48877.jpg,48877
57036,Mr. Burberry Element Burberry for men,burberry perfumes and colognes,"['Green Almond', 'Juniper', 'Ambergris', 'Mineral notes', 'Oakmoss']","Mr. Burberry Element by Burberry is a Amber Fougere fragrance for men. Mr. Burberry Element was launched in 2020. The nose behind this fragrance is Jérôme di Marino. Top note is Green Almond; middle note is Juniper; base notes are Ambergris, Mineral notes and Oakmoss.",https://www.fragrantica.com/perfume/Burberry/Mr-Burberry-Element-60796.html,https://fimgs.net/mdimg/perfume/375x500.60796.jpg,60796
35453,20-20 Antiqua Firenze for women and men,antiqua firenze perfumes and colognes,"['Black Pepper', 'Clary Sage', 'Green Mandarin', 'Peony', 'Lily', 'Vanilla Orchid', 'Benzoin', 'Amberwood', 'Patchouli']","20-20 by Antiqua Firenze is a Floral fragrance for women and men. This is a new fragrance. 20-20 was launched in 2022. The nose behind this fragrance is Enzo Galardi. Top notes are Black Pepper, Clary Sage and Green Mandarin; middle notes are Peony, Lily and Vanilla Orchid; base notes are Benzoin, Amberwood and Patchouli.",https://www.fragrantica.com/perfume/Antiqua-Firenze/20-20-73529.html,https://fimgs.net/mdimg/perfume/375x500.73529.jpg,73529
68208,VIP Samy Andraus Fragrances for women and men,samy andraus fragrances perfumes and colognes,"['Orange Blossom', 'Jasmine', 'Myrrh', 'Opoponax', 'Benzoin', 'Black Amber', 'Patchouli']","VIP by Samy Andraus Fragrances is a Amber fragrance for women and men. VIP was launched in 2020. Top notes are Orange Blossom and Jasmine; middle notes are Myrrh, Opoponax and Benzoin; base notes are Black Amber and Patchouli.",https://www.fragrantica.com/perfume/Samy-Andraus-Fragrances/VIP-62888.html,https://fimgs.net/mdimg/perfume/375x500.62888.jpg,62888
37753,Silk Vanilla Siordia Parfums for women,siordia parfums perfumes and colognes,"['Vanilla', 'Coconut', 'Leather', 'Labdanum', 'Cashmeran', 'Agarwood (Oud)', 'Bitter Orange', 'Champaca', 'Tonka Bean', 'Musk', 'Green Mandarin', 'Jasmine', 'Rose', 'Honeysuckle']",Silk Vanilla by Siordia Parfums is a Floral fragrance for women. Silk Vanilla was launched in 2016. The nose behind this fragrance is Ekaterina Siordia.,https://www.fragrantica.com/perfume/Siordia-Parfums/Silk-Vanilla-48856.html,https://fimgs.net/mdimg/perfume/375x500.48856.jpg,48856
45099,In Full Bloom Kate Spade for women,kate spade perfumes and colognes,"['Green Notes', 'Green Tea', 'Lemon', 'May Rose', 'Rose Petals', 'Lotus', 'Peony', 'White Wood', 'Cedar', 'Peach']","In Full Bloom by Kate Spade is a Floral Green fragrance for women. In Full Bloom was launched in 2018. Top notes are Green Notes, Green Tea and Lemon; middle notes are May Rose, Rose Petals, Lotus and Peony; base notes are White Wood, Cedar and Peach.",https://www.fragrantica.com/perfume/Kate-Spade/In-Full-Bloom-48683.html,https://fimgs.net/mdimg/perfume/375x500.48683.jpg,48683
59508,One To Remember Ainash Parfums for men,ainash parfums perfumes and colognes,"['Palisander Rosewood', 'Lavender', 'Cinnamon', 'Apple', 'Rose', 'Cedar', 'Lily', 'Sandalwood', 'Vanilla', 'Amber', 'Musk']","One To Remember by Ainash Parfums is a Amber Woody fragrance for men. This is a new fragrance. One To Remember was launched in 2022. Top notes are Palisander Rosewood, Lavender, Cinnamon and Apple; middle notes are Rose, Cedar and Lily; base notes are Sandalwood, Vanilla, Amber and Musk.",https://www.fragrantica.com/perfume/Ainash-Parfums/One-To-Remember-80222.html,https://fimgs.net/mdimg/perfume/375x500.80222.jpg,80222
28692,Eau Dadette Santi Burgas for women and men,santi burgas perfumes and colognes,"['Jasmine', 'Bulgarian Rose', 'Ylang-Ylang', 'Heliotrope', 'Sandalwood', 'Incense', 'Myrrh', 'Amber', 'Haitian Vetiver', 'Musk', 'Bourbon Vanilla', 'Raspberry']",Eau Dadette by Santi Burgas is a Floral fragrance for women and men. Eau Dadette was launched in 2016. The nose behind this fragrance is Santi Burgas.,https://www.fragrantica.com/perfume/Santi-Burgas/Eau-Dadette-40890.html,https://fimgs.net/mdimg/perfume/375x500.40890.jpg,40890
15481,Ilía Florescer Natura for women,natura perfumes and colognes,"['Pomelo', 'Pear', 'Mandarin Orange', 'Gardenia', 'Jasmine', 'Lily-of-the-Valley', 'Musk', 'Amber', 'Sandalowood']","Ilía Florescer by Natura is a Floral fragrance for women. Ilía Florescer was launched in 2017. The nose behind this fragrance is Verônica Kato. Top notes are Pomelo, Pear and Mandarin Orange; middle notes are Gardenia, Jasmine and Lily-of-the-Valley; base notes are Musk, Amber and Sandalowood.",https://www.fragrantica.com/perfume/Natura/Ilia-Florescer-58423.html,https://fimgs.net/mdimg/perfume/375x500.58423.jpg,58423
71911,Commedia dell’Arte Brocard for women,brocard perfumes and colognes,"['Orange', 'Lemon', 'Bergamot', 'Apricot', 'Plum', 'Honeysuckle', 'White Flowers', 'Honey', 'Vanilla', 'Musk']","Commedia dell’Arte by Brocard is a Floral Fruity Gourmand fragrance for women. Commedia dell’Arte was launched in 2017. The nose behind this fragrance is Patrice Martin. Top notes are Orange, Lemon and Bergamot; middle notes are Apricot, Plum, Honeysuckle and White Flowers; base notes are Honey, Vanilla and Musk.",https://www.fragrantica.com/perfume/Brocard/Commedia-dell-Arte-45931.html,https://fimgs.net/mdimg/perfume/375x500.45931.jpg,45931
42966,Intimate Daydream Women Secret for women,women secret perfumes and colognes,"['Mandarin Orange', 'Blackberry', 'Tangerine', 'Petitgrain', 'Jasmine', 'Orange Blossom', 'Plum Blossom', 'Tonka Bean', 'Musk', 'Cedar', 'Dark Chocolate']","Intimate Daydream by Women Secret is a Floral Fruity Gourmand fragrance for women. Intimate Daydream was launched in 2021. The nose behind this fragrance is Jérôme di Marino. Top notes are Mandarin Orange, Blackberry, Tangerine and Petitgrain; middle notes are Jasmine, Orange Blossom and Plum Blossom; base notes are Tonka Bean, Musk, Cedar and Dark Chocolate.",https://www.fragrantica.com/perfume/Women-Secret/Intimate-Daydream-70089.html,https://fimgs.net/mdimg/perfume/375x500.70089.jpg,70089
40988,Bohemian Bluebells Zara for women and men,zara perfumes and colognes,"['Lavender', 'Sandalwood', 'Musk']",Bohemian Bluebells by Zara is a Floral Woody Musk fragrance for women and men. Bohemian Bluebells was launched in 2019. The nose behind this fragrance is Jo Malone.,https://www.fragrantica.com/perfume/Zara/Bohemian-Bluebells-58162.html,https://fimgs.net/mdimg/perfume/375x500.58162.jpg,58162
58892,The Collection Confident Oud Hugo Boss for men,hugo boss perfumes and colognes,"['Agarwood (Oud)', 'Bran']",The Collection Confident Oud by Hugo Boss is a Woody Aromatic fragrance for men. The Collection Confident Oud was launched in 2021.,https://www.fragrantica.com/perfume/Hugo-Boss/The-Collection-Confident-Oud-71678.html,https://fimgs.net/mdimg/perfume/375x500.71678.jpg,71678
51330,Chypre-Siam Rogue Perfumery for women and men,rogue perfumery perfumes and colognes,"['Kaffir Lime', 'Basil', 'Jasmine', 'Ylang-Ylang', 'Oakmoss', 'Civet', 'Spices', 'Benzoin', 'Sandalwood', 'Leather']","Chypre-Siam by Rogue Perfumery is a Chypre fragrance for women and men. Chypre-Siam was launched in 2017. The nose behind this fragrance is Manuel Cross. Top notes are Kaffir Lime and Basil; middle notes are Jasmine and Ylang-Ylang; base notes are Oakmoss, Civet, Spices, Benzoin, Sandalwood and Leather.",https://www.fragrantica.com/perfume/Rogue-Perfumery/Chypre-Siam-53816.html,https://fimgs.net/mdimg/perfume/375x500.53816.jpg,53816
76822,O As Original Chateau Berger for women,chateau berger perfumes and colognes,"['Ylang-Ylang', 'Pink Pepper', 'Rose', 'Jasmine', 'Tuberose', 'White Musk', 'Woody Notes']",O As Original by Chateau Berger is a Floral Woody Musk fragrance for women. O As Original was launched in 2018.,https://www.fragrantica.com/perfume/Chateau-Berger/O-As-Original-55098.html,https://fimgs.net/mdimg/perfume/375x500.55098.jpg,55098
6863,Strastni Tanci Cerven Evterpa for women,evterpa perfumes and colognes,"['Hyacinth', 'Magnolia', 'Lilac', 'Violet', 'Jasmine', 'Rose', 'Lily-of-the-Valley', 'Musk', 'Iris']","Strastni Tanci Cerven by Evterpa is a Floral Fruity fragrance for women. Top notes are Hyacinth, Magnolia and Lilac; middle notes are Violet, Jasmine, Rose and Lily-of-the-Valley; base notes are Musk and Iris.",https://www.fragrantica.com/perfume/Evterpa/Strastni-Tanci-Cerven-36396.html,https://fimgs.net/mdimg/perfume/375x500.36396.jpg,36396
45996,Orangerie Musicale Chabaud Maison de Parfum for women and men,chabaud maison de parfum perfumes and colognes,"['Neroli', 'Bergamot', 'Orange', 'Star Anise', 'French orange flower', 'Egyptian Jasmine', 'Benzoin', 'Almond', 'Sugar', 'Vanilla', 'Musk']","Orangerie Musicale by Chabaud Maison de Parfum is a Amber Floral fragrance for women and men. Orangerie Musicale was launched in 2018. The nose behind this fragrance is Patrice Revillard. Top notes are Neroli, Bergamot, Orange and Star Anise; middle notes are French orange flower and Egyptian Jasmine; base notes are Benzoin, Almond, Sugar, Vanilla and Musk.",https://www.fragrantica.com/perfume/Chabaud-Maison-de-Parfum/Orangerie-Musicale-52395.html,https://fimgs.net/mdimg/perfume/375x500.52395.jpg,52395
45263,Arc-en-ciel 1 Million Pleasures CIEL Parfum for women,ciel parfum perfumes and colognes,"['Bergamot', 'Litchi', 'Rose', 'Magnolia', 'Aldehydes', 'Musk', 'Amber', 'Cedar']","Arc-en-ciel 1 Million Pleasures by CIEL Parfum is a Floral fragrance for women. Top notes are Bergamot and Litchi; middle notes are Rose, Magnolia and Aldehydes; base notes are Musk, Amber and Cedar.",https://www.fragrantica.com/perfume/CIEL-Parfum/Arc-en-ciel-1-Million-Pleasures-33959.html,https://fimgs.net/mdimg/perfume/375x500.33959.jpg,33959
57313,Alchimie du Matin Rance 1795 for women and men,rance 1795 perfumes and colognes,"['Gardenia', 'Lemon', 'Woodsy Notes', 'Pink Pepper']",Alchimie du Matin by Rance 1795 is a Aromatic fragrance for women and men. Alchimie du Matin was launched in 2018. The nose behind this fragrance is Luca Maffei.,https://www.fragrantica.com/perfume/Rance-1795/Alchimie-du-Matin-49528.html,https://fimgs.net/mdimg/perfume/375x500.49528.jpg,49528
6060,Izmir Unique'e Luxury for women and men,unique'e luxury perfumes and colognes,"['Pineapple', 'Mandarin Orange', 'Lemon', 'Bergamot', 'Iris', 'Rose', 'Cloves', 'Patchouli', 'Vanilla', 'Tonka Bean', 'Oakmoss', 'Sandalwood']","Izmir by Unique'e Luxury is a fragrance for women and men. Izmir was launched in 2018. Izmir was created by Sylvain Cara, Selim Özen and Bihter Türkan Ergül. Top notes are Pineapple, Mandarin Orange, Lemon and Bergamot; middle notes are Iris, Rose and Cloves; base notes are Patchouli, Vanilla, Tonka Bean, Oakmoss and Sandalwood.",https://www.fragrantica.com/perfume/Unique-e-Luxury/Izmir-50402.html,https://fimgs.net/mdimg/perfume/375x500.50402.jpg,50402
26333,Madina Eau de Dubai for women and men,eau de dubai perfumes and colognes,"['Rose', 'Black Pepper', 'Cypriol Oil or Nagarmotha', 'Vanilla', 'Cedar']",Madina  by Eau de Dubai is a Amber Vanilla fragrance for women and men. Madina  was launched in 2020. Top notes are Rose and Black Pepper; middle note is Cypriol Oil or Nagarmotha; base notes are Vanilla and Cedar.,https://www.fragrantica.com/perfume/Eau-de-Dubai/Madina-69646.html,https://fimgs.net/mdimg/perfume/375x500.69646.jpg,69646
57864,Pamella Roland Eau de Parfum Pamella Roland for women,pamella roland perfumes and colognes,"['Bergamot', 'Black Currant', 'Pink Pepper', 'Rose de Mai', 'Damask Rose', 'Rose Oil', 'Patchouli', 'Moss', 'Amberwood', 'Tonka Bean']","Pamella Roland Eau de Parfum by Pamella Roland is a Floral Fruity fragrance for women. Pamella Roland Eau de Parfum was launched in 2021. The nose behind this fragrance is Gabriela Chelariu. Top notes are Bergamot, Black Currant and Pink Pepper; middle notes are Rose de Mai, Damask Rose and Rose Oil; base notes are Patchouli, Moss, Amberwood and Tonka Bean.",https://www.fragrantica.com/perfume/Pamella-Roland/Pamella-Roland-Eau-de-Parfum-66731.html,https://fimgs.net/mdimg/perfume/375x500.66731.jpg,66731
37475,Meu Bem Estar Campos de Lavanda Água de Cheiro for women,água de cheiro perfumes and colognes,"['Neroli', 'Sage', 'Patchouli']",Meu Bem Estar Campos de Lavanda by Água de Cheiro is a Floral fragrance for women. Meu Bem Estar Campos de Lavanda was launched in 2018. Top note is Neroli; middle note is Sage; base note is Patchouli.,https://www.fragrantica.com/perfume/Agua-de-Cheiro/Meu-Bem-Estar-Campos-de-Lavanda-68990.html,https://fimgs.net/mdimg/perfume/375x500.68990.jpg,68990
14193,Eau Noble (2022) Le Galion for women and men,le galion perfumes and colognes,"['Blood Orange', 'Rhubarb', 'Reseda', 'Mastic or Lentisque', 'Geranium', 'Pine Tree Needles', 'Indian Ginger', 'Sandalwood', 'Cypress', 'Atlas Cedar', 'Patchouli', 'Labdanum']","Eau Noble (2022) by Le Galion is a Citrus Aromatic fragrance for women and men. This is a new fragrance. Eau Noble (2022) was launched in 2022. The nose behind this fragrance is Rodrigo Flores-Roux. Top notes are Blood Orange, Rhubarb, Reseda and Mastic or Lentisque; middle notes are Geranium, Pine Tree Needles, Indian Ginger and Sandalwood; base notes are Cypress, Atlas Cedar, Patchouli and Labdanum.",https://www.fragrantica.com/perfume/Le-Galion/Eau-Noble-2022-74382.html,https://fimgs.net/mdimg/perfume/375x500.74382.jpg,74382
69569,Sweet Sparkling Skinfood for women,skinfood perfumes and colognes,"['Orange', 'Bergamot', 'Peach', 'Geranium', 'Freesia']",Sweet Sparkling by Skinfood is a Floral Fruity fragrance for women.,https://www.fragrantica.com/perfume/Skinfood/Sweet-Sparkling-37628.html,https://fimgs.net/mdimg/perfume/375x500.37628.jpg,37628
77998,Apricot The Parfumerie for women and men,the parfumerie perfumes and colognes,"['Fruity Notes', 'Hazelnut', 'Spices', 'Apricot']",Apricot by The Parfumerie is a Amber fragrance for women and men. Apricot was launched in 2020.,https://www.fragrantica.com/perfume/The-Parfumerie/Apricot-60754.html,https://fimgs.net/mdimg/perfume/375x500.60754.jpg,60754
39024,Harmony Reserved for women,reserved perfumes and colognes,"['Bergamot', 'Tea', 'Citruses', 'Sugar', 'Musk']",Harmony by Reserved is a Citrus fragrance for women. Harmony was launched in 2018.,https://www.fragrantica.com/perfume/Reserved/Harmony-64683.html,https://fimgs.net/mdimg/perfume/375x500.64683.jpg,64683
75465,Tempting Rose Zara for women,zara perfumes and colognes,"['Red Fruits', 'Rose', 'Coffee']",Tempting Rose by Zara is a Floral Fruity Gourmand fragrance for women. Tempting Rose was launched in 2018. Top note is Red Fruits; middle note is Rose; base note is Coffee.,https://www.fragrantica.com/perfume/Zara/Tempting-Rose-52492.html,https://fimgs.net/mdimg/perfume/375x500.52492.jpg,52492
