id,title,designer,notes,description,url,img_url,img_id
17065,Musk Malaki Chopard for women and men,chopard perfumes and colognes,"['Musk', 'Black Pepper', 'Cedar', 'Leather']",Musk Malaki by Chopard is a Amber Woody fragrance for women and men. Musk Malaki was launched in 2017. The nose behind this fragrance is Nicolas Beaulieu. Top note is Musk; middle notes are Black Pepper and Cedar; base note is Leather.,https://www.fragrantica.com/perfume/Chopard/Musk-Malaki-43759.html,https://fimgs.net/mdimg/perfume/375x500.43759.jpg,43759
6846,Wicked Stepmother Mirus Fine Fragrance for women,mirus fine fragrance perfumes and colognes,"['Jasmine', 'Jasmine Sambac', 'Carnation', 'Litchi', 'Orange', 'Vanilla', 'Amber']",Wicked Stepmother by Mirus Fine Fragrance is a Floral fragrance for women. Wicked Stepmother was launched in 2015. The nose behind this fragrance is Neal Peters.,https://www.fragrantica.com/perfume/Mirus-Fine-Fragrance/Wicked-Stepmother-45467.html,https://fimgs.net/mdimg/perfume/375x500.45467.jpg,45467
52505,Sweet Inspirations Zoella Beauty for women,zoella beauty perfumes and colognes,"['Macarons', 'Vanilla', 'Honey', 'Almond', 'Cacao Pod']",Sweet Inspirations  by Zoella Beauty is a Amber Vanilla fragrance for women. Sweet Inspirations  was launched in 2016.,https://www.fragrantica.com/perfume/Zoella-Beauty/Sweet-Inspirations-39088.html,https://fimgs.net/mdimg/perfume/375x500.39088.jpg,39088
77541,Passion Musk Ésika for women,ésika perfumes and colognes,"['Iris Flower', 'Vanilla Orchid', 'White Musk']",Passion Musk by Ésika is a Floral fragrance for women. The nose behind this fragrance is Frank Voelkl.,https://www.fragrantica.com/perfume/Esika/Passion-Musk-36581.html,https://fimgs.net/mdimg/perfume/375x500.36581.jpg,36581
13349,Oud Wood Orientica for women and men,orientica perfumes and colognes,"['Cumin', 'Bergamot', 'Lemon', 'Sandalwood', 'Leather', 'Cedar', 'Tobacco', 'Patchouli']","Oud Wood by Orientica is a Woody Spicy fragrance for women and men. Oud Wood was launched in 2018. Top notes are Cumin, Bergamot and Lemon; middle notes are Sandalwood, Leather and Cedar; base notes are Tobacco and Patchouli.",https://www.fragrantica.com/perfume/Orientica/Oud-Wood-55920.html,https://fimgs.net/mdimg/perfume/375x500.55920.jpg,55920
72012,La Perla Luminous La Perla for women,la perla perfumes and colognes,"['Ambrette (Musk Mallow)', 'Jasmine Sambac', 'Sandalwood', 'Cedar']",La Perla Luminous by La Perla is a Floral Woody Musk fragrance for women. This is a new fragrance. La Perla Luminous was launched in 2022. The nose behind this fragrance is Louise Turner. Top note is Ambrette (Musk Mallow); middle notes are Jasmine Sambac and Sandalwood; base note is Cedar.,https://www.fragrantica.com/perfume/La-Perla/La-Perla-Luminous-75869.html,https://fimgs.net/mdimg/perfume/375x500.75869.jpg,75869
36417,Shake The Night Puma for men,puma perfumes and colognes,"['Sea Notes', 'Citruses', 'Mai Tai Cocktail', 'Woody Notes', 'Smoke']",Shake The Night by Puma is a Citrus Aromatic fragrance for men. Shake The Night was launched in 2016.,https://www.fragrantica.com/perfume/Puma/Shake-The-Night-48728.html,https://fimgs.net/mdimg/perfume/375x500.48728.jpg,48728
3052,1991 Kafyav Evterpa for men,evterpa perfumes and colognes,"['Lime', 'Mandarin Orange', 'Sage', 'Iris', 'Lavender', 'Cacao', 'Amber', 'Musk', 'Moss']","1991 Kafyav by Evterpa is a Amber fragrance for men. Top notes are Lime, Mandarin Orange and Sage; middle notes are Iris, Lavender and Cacao; base notes are Amber, Musk and Moss.",https://www.fragrantica.com/perfume/Evterpa/1991-Kafyav-36298.html,https://fimgs.net/mdimg/perfume/375x500.36298.jpg,36298
54831,Time To Target M.INT for women and men,m.int perfumes and colognes,"['Exotic Fruits', 'Bergamot', 'Lavender', 'Galbanum', 'Pink Pepper', 'Patchouli', 'Cedar', 'Oakmoss', 'Leather', 'Musk']","Time To Target by M.INT is a fragrance for women and men. Time To Target was launched in 2016. The nose behind this fragrance is Karine Vinchon Spehner. Top notes are Exotic Fruits, Bergamot and Lavender; middle notes are Galbanum, Pink Pepper, Patchouli and Cedar; base notes are Oakmoss, Leather and Musk.",https://www.fragrantica.com/perfume/M-INT/Time-To-Target-47771.html,https://fimgs.net/mdimg/perfume/375x500.47771.jpg,47771
40905,French Coffee Al-Rehab for women and men,al-rehab perfumes and colognes,"['Coffee', 'Vanilla', 'Caramel', 'Milk', 'Sugar', 'Cacao', 'Cinnamon']",French Coffee by Al-Rehab is a fragrance for women and men.,https://www.fragrantica.com/perfume/Al-Rehab/French-Coffee-78016.html,https://fimgs.net/mdimg/perfume/375x500.78016.jpg,78016
1364,Dominance Superz. for men,superz. perfumes and colognes,"['Citruses', 'Woodsy Notes', 'Earthy Notes', 'Lavender', 'Aromatic Notes', 'Sea Notes', 'Amber', 'Patchouli', 'Spicy Notes', 'Cypriol Oil or Nagarmotha', 'Balsamic Notes']",Dominance by Superz. is a Amber Woody fragrance for men. Dominance was launched in 2021. The nose behind this fragrance is Hüseyin Erdoğmuş.,https://www.fragrantica.com/perfume/Superz/Dominance-79418.html,https://fimgs.net/mdimg/perfume/375x500.79418.jpg,79418
7557,Son Of a Gun Miles Wambaugh for women and men,miles wambaugh perfumes and colognes,"['Pink Pepper', 'Leather', 'Cedar', 'Patchouli', 'Amber']","Son Of a Gun by Miles Wambaugh is a Chypre fragrance for women and men. Son Of a Gun was launched in 2019. Son Of a Gun was created by Dominique Ropion and Jean-Louis Sieuzac. Top note is Pink Pepper; middle note is Leather; base notes are Cedar, Patchouli and Amber.",https://www.fragrantica.com/perfume/Miles-Wambaugh/Son-Of-a-Gun-57316.html,https://fimgs.net/mdimg/perfume/375x500.57316.jpg,57316
17656,Flacon One Nose Perfumes for women and men,nose perfumes perfumes and colognes,"['Cypress', 'Watermelon', 'Virginian Cedar', 'Amber', 'Iris', 'Sandalwood']","Flacon One by Nose Perfumes is a fragrance for women and men. This is a new fragrance. Flacon One was launched in 2022. The nose behind this fragrance is Timur Solodov. Top notes are Cypress and Watermelon; middle note is Virginian Cedar; base notes are Amber, Iris and Sandalwood.",https://www.fragrantica.com/perfume/Nose-Perfumes/Flacon-One-74786.html,https://fimgs.net/mdimg/perfume/375x500.74786.jpg,74786
26679,Rose Chant Novellista for women and men,novellista perfumes and colognes,"['Rose', 'Turkish Rose', 'Iris', 'Cinnamon', 'Bulgarian Rose', 'Jasmine Sambac', 'Cinnamon', 'Musk', 'Cedar', 'Sandalwood']","Rose Chant by Novellista is a Floral Woody Musk fragrance for women and men. This is a new fragrance. Rose Chant was launched in 2022. Top notes are Rose, Turkish Rose, Iris and Cinnamon; middle notes are Bulgarian Rose, Jasmine Sambac and Cinnamon; base notes are Musk, Cedar and Sandalwood.",https://www.fragrantica.com/perfume/Novellista/Rose-Chant-72859.html,https://fimgs.net/mdimg/perfume/375x500.72859.jpg,72859
67306,Inspired by Respect David Beckham for men,david beckham perfumes and colognes,"['Lavender', 'Bergamot', 'Grapefruit', 'Cardamom', 'Pineapple', 'Clove', 'Amber Xtreme', 'Cedar', 'Orris']","Inspired by Respect by David Beckham is a Woody Spicy fragrance for men. Inspired by Respect was launched in 2018. The nose behind this fragrance is Juliette Karagueuzoglou. Top notes are Lavender, Bergamot and Grapefruit; middle notes are Cardamom, Pineapple and Clove; base notes are Amber Xtreme, Cedar and Orris.",https://www.fragrantica.com/perfume/David-Beckham/Inspired-by-Respect-51211.html,https://fimgs.net/mdimg/perfume/375x500.51211.jpg,51211
641,Oud Lubani Agar Aura for women and men,agar aura perfumes and colognes,"['Olibanum', 'Laotian Oud', 'Agarwood (Oud)']",Oud Lubani by Agar Aura is a Woody Spicy fragrance for women and men. Oud Lubani was launched in 2020. The nose behind this fragrance is Taha Syed.,https://www.fragrantica.com/perfume/Agar-Aura/Oud-Lubani-68086.html,https://fimgs.net/mdimg/perfume/375x500.68086.jpg,68086
75818,Azora Attar Collection for women and men,attar collection perfumes and colognes,"['Litchi', 'Bergamot', 'Orange', 'Floral Notes', 'Peach', 'Jasmine', 'White Musk', 'Woody Notes']","Azora by Attar Collection is a Floral Fruity fragrance for women and men. Azora was launched in 2018. The nose behind this fragrance is Miroslav Petkov. Top notes are Litchi, Bergamot and Orange; middle notes are Floral Notes, Peach and Jasmine; base notes are White Musk and Woody Notes.",https://www.fragrantica.com/perfume/Attar-Collection/Azora-50343.html,https://fimgs.net/mdimg/perfume/375x500.50343.jpg,50343
27838,Après Vous Alex Simone for women and men,alex simone perfumes and colognes,"['Coconut Milk', 'Powdery Notes', 'Cedar', 'Sandalwood', 'Iris', 'Wallflower', 'Woody Notes', 'Amber', 'Vanilla']","Après Vous by Alex Simone is a Amber Floral fragrance for women and men. Après Vous was launched in 2017. The nose behind this fragrance is Bertrand Duchaufour. Top notes are Coconut Milk, Powdery Notes and Cedar; middle notes are Sandalwood, Iris and Wallflower; base notes are Woody Notes, Amber and Vanilla.",https://www.fragrantica.com/perfume/Alex-Simone/Apres-Vous-44271.html,https://fimgs.net/mdimg/perfume/375x500.44271.jpg,44271
42082,Armani Prive Rouge Malachite Giorgio Armani for women and men,giorgio armani perfumes and colognes,"['Tuberose', 'Pink Pepper', 'Clary Sage', 'Tuberose', 'Jasmine Sambac', 'Ylang-Ylang', 'Benzoin', 'Cashmeran', 'Orange Blossom', 'Tuberose', 'Amber']","Armani Prive Rouge Malachite by Giorgio Armani is a Amber Floral fragrance for women and men. Armani Prive Rouge Malachite was launched in 2016. The nose behind this fragrance is Pascal Gaurin. Top notes are Tuberose, Pink Pepper and Clary Sage; middle notes are Tuberose, Jasmine Sambac, Ylang-Ylang, Benzoin, Cashmeran and Orange Blossom; base notes are Tuberose and Amber.",https://www.fragrantica.com/perfume/Giorgio-Armani/Armani-Prive-Rouge-Malachite-34589.html,https://fimgs.net/mdimg/perfume/375x500.34589.jpg,34589
18099,Ambitious Ghalati for women and men,ghalati perfumes and colognes,"['Bergamot', 'Pink Pepper', 'Jasmine', 'Vetiver', 'Tobacco', 'Amber', 'Musk']","Ambitious by Ghalati is a Amber Floral fragrance for women and men. This is a new fragrance. Ambitious was launched in 2022. The nose behind this fragrance is Chris Maurice. Top notes are Bergamot and Pink Pepper; middle notes are Jasmine and Vetiver; base notes are Tobacco, Amber and Musk.",https://www.fragrantica.com/perfume/Ghalati/Ambitious-79183.html,https://fimgs.net/mdimg/perfume/375x500.79183.jpg,79183
41620,Vivre Molyneux for women,molyneux perfumes and colognes,"['Plum', 'Black Currant', 'Peach', 'Rose', 'Jasmine Sambac', 'Lily-of-the-Valley', 'Sandalwood', 'Tonka Bean', 'Vanilla']","Vivre by Molyneux is a Chypre fragrance for women. Vivre was launched in 2017. Top notes are Plum, Black Currant and Peach; middle notes are Rose, Jasmine Sambac and Lily-of-the-Valley; base notes are Sandalwood, Tonka Bean and Vanilla.",https://www.fragrantica.com/perfume/Molyneux/Vivre-56270.html,https://fimgs.net/mdimg/perfume/375x500.56270.jpg,56270
26987,Good Morning Sir Mine Perfume Lab for men,mine perfume lab perfumes and colognes,"['Bergamot', 'Orange', 'Orange Blossom', 'Patchouli', 'Cedar', 'Vetiver', 'Spices']","Good Morning Sir by Mine Perfume Lab is a Citrus fragrance for men. Good Morning Sir was launched in 2017. Top notes are Bergamot and Orange; middle note is Orange Blossom; base notes are Patchouli, Cedar, Vetiver and Spices.",https://www.fragrantica.com/perfume/Mine-Perfume-Lab/Good-Morning-Sir-51896.html,https://fimgs.net/mdimg/perfume/375x500.51896.jpg,51896
25231,Chicomecoatl Azteque for women and men,azteque perfumes and colognes,"['Agave', 'Strelitzia', 'Kiwi', 'Basil', 'Cumin', 'Juniper', 'Rosemary', 'Moss', 'Green Tea', 'Vetiver', 'Sandalwood', 'Musk', 'Cedar', 'Oak']","Chicomecoatl by Azteque is a Aromatic Fougere fragrance for women and men. Chicomecoatl was launched in 2020. The nose behind this fragrance is Jacopo Luccato. Top notes are Agave, Strelitzia, Kiwi, Basil and Cumin; middle notes are Juniper, Rosemary, Moss and Green Tea; base notes are Vetiver, Sandalwood, Musk, Cedar and Oak.",https://www.fragrantica.com/perfume/Azteque/Chicomecoatl-63536.html,https://fimgs.net/mdimg/perfume/375x500.63536.jpg,63536
76179,Инициация Theme for women and men,theme perfumes and colognes,"['Orange Blossom', 'Iris', 'Magnolia', 'Jasmine', 'Tiare Flower', 'White Tobacco', 'Musk', 'Green Tea', 'Sandalwood']","Инициация by Theme is a Floral fragrance for women and men. Инициация was launched in 2019. The nose behind this fragrance is Elena Razumova. Top note is Orange Blossom; middle notes are Iris, Magnolia, Jasmine, Tiare Flower and White Tobacco; base notes are Musk, Green Tea and Sandalwood.",https://www.fragrantica.com/perfume/Theme/Iniciacia-72751.html,https://fimgs.net/mdimg/perfume/375x500.72751.jpg,72751
72970,Vetiris Lubin for women and men,lubin perfumes and colognes,"['Lime', 'Lemon', 'Bergamot', 'Petitgrain', 'Clary Sage', 'Neroli', 'Cardamom', 'Black Pepper', 'Clove', 'Vetiver', 'Iris', 'Cypress', 'Nutmeg']","Vetiris by Lubin is a Woody Spicy fragrance for women and men. Vetiris was launched in 2017. The nose behind this fragrance is Delphine Thierry. Top notes are Lime, Lemon, Bergamot and Petitgrain; middle notes are Clary Sage, Neroli, Cardamom, Black Pepper and Clove; base notes are Vetiver, Iris, Cypress and Nutmeg.",https://www.fragrantica.com/perfume/Lubin/Vetiris-47308.html,https://fimgs.net/mdimg/perfume/375x500.47308.jpg,47308
28024,Kisses Rain Labios Rotos Renier Perfumes for women and men,renier perfumes perfumes and colognes,"['Cardamom', 'Rose', 'Coconut', 'Jasmine', 'Bergamot', 'Almond', 'Heliotrope', 'Coffee', 'Agarwood (Oud)', 'Sandalwood', 'Atlas Cedar', 'Vanilla', 'Tonka Bean', 'Tolu Balsam', 'Amber', 'Musk', 'Labdanum', 'Patchouli']","Kisses Rain Labios Rotos by Renier Perfumes is a Amber fragrance for women and men. This is a new fragrance. Kisses Rain Labios Rotos was launched in 2023. The nose behind this fragrance is Chris Maurice. Top notes are Cardamom, Rose, Coconut, Jasmine and Bergamot; middle notes are Almond, Heliotrope, Coffee, Agarwood (Oud), Sandalwood and Atlas Cedar; base notes are Vanilla, Tonka Bean, Tolu Balsam, Amber, Musk, Labdanum and Patchouli.",https://www.fragrantica.com/perfume/Renier-Perfumes/Kisses-Rain-Labios-Rotos-79505.html,https://fimgs.net/mdimg/perfume/375x500.79505.jpg,79505
1574,Sweet Dream In Sahara Franck Boclet for women and men,franck boclet perfumes and colognes,"['Saffron', 'Red Fruits', 'Pink Pepper', 'Black Pepper', 'Benzoin', 'Jasmine', 'Geranium', 'Patchouli', 'Amber', 'Vanilla', 'Orris Root']","Sweet Dream In Sahara by Franck Boclet is a fragrance for women and men. This is a new fragrance. Sweet Dream In Sahara was launched in 2022. Top notes are Saffron, Red Fruits, Pink Pepper and Black Pepper; middle notes are Benzoin, Jasmine and Geranium; base notes are Patchouli, Amber, Vanilla and Orris Root.",https://www.fragrantica.com/perfume/Franck-Boclet/Sweet-Dream-In-Sahara-74917.html,https://fimgs.net/mdimg/perfume/375x500.74917.jpg,74917
71204,Felicity Chamma da Amazônia for women and men,chamma da amazônia perfumes and colognes,"['Floral Notes', 'Sweet Notes', 'Oily Notes', 'Allspice']",Felicity by Chamma da Amazônia is a Amber Floral fragrance for women and men. Felicity was launched in 2020. The nose behind this fragrance is Oscar Chamma.,https://www.fragrantica.com/perfume/Chamma-da-Amazonia/Felicity-61892.html,https://fimgs.net/mdimg/perfume/375x500.61892.jpg,61892
69514,Pop Exotic Yves Rocher for women,yves rocher perfumes and colognes,"['Pineapple', 'Exotic Fruits', 'Flowers']",Pop Exotic by Yves Rocher is a Floral Fruity fragrance for women. Pop Exotic was launched in 2016.,https://www.fragrantica.com/perfume/Yves-Rocher/Pop-Exotic-37193.html,https://fimgs.net/mdimg/perfume/375x500.37193.jpg,37193
45157,Floralia Peonia Reale Borsari for women,borsari perfumes and colognes,"['Apple Blossom', 'Freesia', 'Lemon', 'Jasmine', 'Lily', 'Cacao', 'Raspberry', 'Amber', 'White Musk', 'Cedar']","Floralia Peonia Reale by Borsari is a Floral fragrance for women. Floralia Peonia Reale was launched in 2014. Top notes are Apple Blossom, Freesia and Lemon; middle notes are Jasmine, Lily, Cacao and Raspberry; base notes are Amber, White Musk and Cedar.",https://www.fragrantica.com/perfume/Borsari/Floralia-Peonia-Reale-64234.html,https://fimgs.net/mdimg/perfume/375x500.64234.jpg,64234
74204,Blue Cypress Amberfig for women and men,amberfig perfumes and colognes,"['Cypress', 'Coriander', 'Lavender', 'Cardamom', 'Ylang-Ylang', 'Lily', 'Rose', 'Chamomile', 'Ambroxan', 'White Musk', 'Vetiver']","Blue Cypress by Amberfig is a Woody Aromatic fragrance for women and men. Blue Cypress was launched in 2016. The nose behind this fragrance is David Magalhães. Top notes are Cypress, Coriander, Lavender and Cardamom; middle notes are Ylang-Ylang, Lily, Rose and Chamomile; base notes are Ambroxan, White Musk and Vetiver.",https://www.fragrantica.com/perfume/Amberfig/Blue-Cypress-44567.html,https://fimgs.net/mdimg/perfume/375x500.44567.jpg,44567
34988,Madame Coccinelle Antos Cosmesi Naturale for women,antos cosmesi naturale perfumes and colognes,"['Cardamom', 'Freesia', 'Violet', 'Rose', 'Musk', 'Amber']",Madame Coccinelle by Antos Cosmesi Naturale is a fragrance for women. Top notes are Cardamom and Freesia; middle notes are Violet and Rose; base notes are Musk and Amber.,https://www.fragrantica.com/perfume/Antos-Cosmesi-Naturale/Madame-Coccinelle-75919.html,https://fimgs.net/mdimg/perfume/375x500.75919.jpg,75919
17712,Rhubay Darling* for women,darling* perfumes and colognes,"['Rhubarb', 'Passionfruit', 'Grapefruit', 'Carambola (Star Fruit)', 'Freesia', 'Grapes', 'Peach', 'Geranium', 'Peony', 'Vanilla', 'Musk', 'Amber']","Rhubay by Darling* is a Floral Fruity fragrance for women. This is a new fragrance. Rhubay was launched in 2023. The nose behind this fragrance is Bertrand Duchaufour. Top notes are Rhubarb, Passionfruit, Grapefruit and Carambola (Star Fruit); middle notes are Freesia, Grapes, Peach, Geranium and Peony; base notes are Vanilla, Musk and Amber.",https://www.fragrantica.com/perfume/Darling/Rhubay-79365.html,https://fimgs.net/mdimg/perfume/375x500.79365.jpg,79365
51301,Betula Olfactive Pharmacy for women and men,olfactive pharmacy perfumes and colognes,"['Cedar', 'Green Notes', 'Bergamot', 'Birch Leaf', 'Cedar Needles', 'Rose', 'Jasmine', 'Oak', 'Cedar', 'Birch Tar', 'Vetiver', 'Amber', 'Musk', 'Arnica']","Betula by Olfactive Pharmacy is a Woody Aromatic fragrance for women and men. Betula was launched in 2020. The nose behind this fragrance is Mark Buxton. Top notes are Cedar, Green Notes, Bergamot and Birch Leaf; middle notes are Cedar Needles, Rose, Jasmine and Oak; base notes are Cedar, Birch Tar, Vetiver, Amber, Musk and Arnica.",https://www.fragrantica.com/perfume/Olfactive-Pharmacy/Betula-76245.html,https://fimgs.net/mdimg/perfume/375x500.76245.jpg,76245
7806,Dark Musk Elixirs Of Eden for women and men,elixirs of eden perfumes and colognes,"['Cinnamon', 'Cloves', 'Musk', 'Vanilla', 'Sandalwood', 'Cedar', 'Lavender', 'Amber']",Dark Musk by Elixirs Of Eden is a Woody Spicy fragrance for women and men. The nose behind this fragrance is Myra Shaikh.,https://www.fragrantica.com/perfume/Elixirs-Of-Eden/Dark-Musk-50556.html,https://fimgs.net/mdimg/perfume/375x500.50556.jpg,50556
33993,Zatz Thera Cosméticos for women,thera cosméticos perfumes and colognes,"['Cassis', 'Plum', 'Pomelo', 'Sandalwood', 'White Lily', 'Violet', 'Hazelnut', 'Caramel', 'Musk']","Zatz by Thera Cosméticos is a Amber Floral fragrance for women. Zatz was launched in 2018. The nose behind this fragrance is Mário Torri Neto. Top notes are Cassis, Plum and Pomelo; middle notes are Sandalwood, White Lily and Violet; base notes are Hazelnut, Caramel and Musk.",https://www.fragrantica.com/perfume/Thera-Cosmeticos/Zatz-56182.html,https://fimgs.net/mdimg/perfume/375x500.56182.jpg,56182
25019,Ghala Al Bahrain Al-Rehab for women,al-rehab perfumes and colognes,"['Orange', 'Violet', 'Jasmine', 'Lilac', 'Rose', 'Exotic Fruits', 'Pineapple', 'Pomegranate', 'Lemon', 'Fruity Notes', 'Strawberry', 'Cinnamon', 'Cloves', 'Nutmeg']","Ghala Al Bahrain by Al-Rehab is a Floral Fruity Gourmand fragrance for women. Ghala Al Bahrain was launched in 2017. Top notes are Orange, Violet, Jasmine and Lilac; middle notes are Rose, Exotic Fruits, Pineapple, Pomegranate, Lemon, Fruity Notes and Strawberry; base notes are Cinnamon, Cloves and Nutmeg.",https://www.fragrantica.com/perfume/Al-Rehab/Ghala-Al-Bahrain-63868.html,https://fimgs.net/mdimg/perfume/375x500.63868.jpg,63868
40570,Beautiful Monster Blackcliff Parfums for women and men,blackcliff parfums perfumes and colognes,"['Birch Tar', 'Mineral notes', 'Labdanum', 'Guaiac Wood', 'Black Pepper', 'Geranium', 'Patchouli', 'Bergamot', 'Atlas Cedar', 'Cinnamon']",Beautiful Monster by Blackcliff Parfums is a Leather fragrance for women and men. Beautiful Monster was launched in 2021. The nose behind this fragrance is Kyle Mott-Kannenberg.,https://www.fragrantica.com/perfume/Blackcliff-Parfums/Beautiful-Monster-71878.html,https://fimgs.net/mdimg/perfume/375x500.71878.jpg,71878
55145,Ethnos Essenzialmente Laura for men,essenzialmente laura perfumes and colognes,"['Leather', 'Woody Notes', 'Honey']",Ethnos by Essenzialmente Laura is a fragrance for men. Ethnos was launched in 2020. The nose behind this fragrance is Laura Bosetti Tonatto.,https://www.fragrantica.com/perfume/Essenzialmente-Laura/Ethnos-69524.html,https://fimgs.net/mdimg/perfume/375x500.69524.jpg,69524
73711,UDV Star Ulric de Varens for men,ulric de varens perfumes and colognes,"['Bergamot', 'Mandarin Orange', 'Apple', 'Sage', 'Lavender', 'Pine', 'Patchouli', 'Leather', 'Fir']","UDV Star by Ulric de Varens is a Citrus Aromatic fragrance for men. Top notes are Bergamot, Mandarin Orange and Apple; middle notes are Sage, Lavender and Pine; base notes are Patchouli, Leather and Fir.",https://www.fragrantica.com/perfume/Ulric-de-Varens/UDV-Star-53336.html,https://fimgs.net/mdimg/perfume/375x500.53336.jpg,53336
12164,T4 Simply Legend Tiffi for men,tiffi perfumes and colognes,"['Citruses', 'Bitter Orange', 'Grapefruit', 'Cardamom', 'Rose', 'Patchouli', 'Cedar', 'Jasmine', 'Gardenia', 'Sandalwood', 'Lily-of-the-Valley', 'Oakmoss', 'Amber']","T4 Simply Legend by Tiffi is a Woody Chypre fragrance for men. Top notes are Citruses, Bitter Orange, Grapefruit and Cardamom; middle notes are Rose, Patchouli, Cedar, Jasmine, Gardenia, Sandalwood and Lily-of-the-Valley; base notes are Oakmoss and Amber.",https://www.fragrantica.com/perfume/Tiffi/T4-Simply-Legend-45067.html,https://fimgs.net/mdimg/perfume/375x500.45067.jpg,45067
12036,Tocade 2018 Rochas for women,rochas perfumes and colognes,"['Geranium', 'Bergamot', 'Rose', 'Iris', 'Jasmine', 'Vanilla', 'Amber', 'Tonka Bean', 'Almond', 'Labdanum']","Tocade 2018 by Rochas is a Amber Floral fragrance for women. Tocade 2018 was launched in 2018. Top notes are Geranium and Bergamot; middle notes are Rose, Iris and Jasmine; base notes are Vanilla, Amber, Tonka Bean, Almond and Labdanum.",https://www.fragrantica.com/perfume/Rochas/Tocade-2018-52252.html,https://fimgs.net/mdimg/perfume/375x500.52252.jpg,52252
55285,Donna Gherardini for women,gherardini perfumes and colognes,"['Tagetes', 'Lily-of-the-Valley', 'Jasmine', 'Violet', 'Iris', 'Sandalwood', 'Musk', 'Vanilla']","Donna by Gherardini is a fragrance for women. Donna was launched in 1982. Top notes are Tagetes and Lily-of-the-Valley; middle notes are Jasmine, Violet and Iris; base notes are Sandalwood, Musk and Vanilla.",https://www.fragrantica.com/perfume/Gherardini/Donna-63879.html,https://fimgs.net/mdimg/perfume/375x500.63879.jpg,63879
47951,Imperial Bleu Pour Homme Peter Jacobs for men,peter jacobs perfumes and colognes,"['Lavender', 'Bergamot', 'Green Leaves', 'Coffee', 'Cedar', 'Amber', 'Vanilla', 'Patchouli', 'Tonka Bean']","Imperial Bleu Pour Homme by Peter Jacobs is a Amber Woody fragrance for men. Imperial Bleu Pour Homme was launched in 2018. The nose behind this fragrance is Peter Jacobs. Top notes are Lavender, Bergamot and Green Leaves; middle notes are Coffee and Cedar; base notes are Amber, Vanilla, Patchouli and Tonka Bean.",https://www.fragrantica.com/perfume/Peter-Jacobs/Imperial-Bleu-Pour-Homme-53018.html,https://fimgs.net/mdimg/perfume/375x500.53018.jpg,53018
37048,Sea Breeze Swiss Arabian for women and men,swiss arabian perfumes and colognes,"['Melon', 'Lemon', 'Water Lily']",Sea Breeze by Swiss Arabian is a Aromatic Fougere fragrance for women and men. Sea Breeze was launched in 2019.,https://www.fragrantica.com/perfume/Swiss-Arabian/Sea-Breeze-63953.html,https://fimgs.net/mdimg/perfume/375x500.63953.jpg,63953
22615,Terra Incognita Siberia Brocard for women and men,brocard perfumes and colognes,"['Ozonic notes', 'Water Notes', 'Green Grass', 'Palisander Rosewood', 'Cyclamen', 'Jasmine', 'Lily-of-the-Valley', 'Smoke', 'Creosote Bush', 'Musk', 'Fir', 'Woody Notes', 'Patchouli']","Terra Incognita Siberia by Brocard is a Aromatic Aquatic fragrance for women and men. Terra Incognita Siberia was launched in 2017. The nose behind this fragrance is Philippe Bousseton. Top notes are Ozonic notes, Water Notes and Green Grass; middle notes are Palisander Rosewood, Cyclamen, Jasmine and Lily-of-the-Valley; base notes are Smoke, Creosote Bush, Musk, Fir, Woody Notes and Patchouli.",https://www.fragrantica.com/perfume/Brocard/Terra-Incognita-Siberia-48089.html,https://fimgs.net/mdimg/perfume/375x500.48089.jpg,48089
