id,title,designer,notes,description,url,img_url,img_id
72367,Grey's Cabin Solstice Scents for women and men,solstice scents perfumes and colognes,"['Copal', 'Cacao', 'Smoke', 'Tobacco', 'Coal', 'Spicy Notes', 'Cedar', 'Black Musk']",Grey's Cabin by Solstice Scents is a fragrance for women and men. The nose behind this fragrance is Angela St.John.,https://www.fragrantica.com/perfume/Solstice-Scents/Grey-s-Cabin-36782.html,https://fimgs.net/mdimg/perfume/375x500.36782.jpg,36782
72285,Valentino Uomo Born In Roma Coral Fantasy Valentino for men,valentino perfumes and colognes,"['Red Apple', 'Cardamom', 'Calabrian bergamot', 'Lavender', 'Bourbon Geranium', 'Clary Sage', 'Tobacco Leaf', 'Patchouli', 'Haitian Vetiver']","Valentino Uomo Born In Roma Coral Fantasy by Valentino is a Woody Aromatic fragrance for men. This is a new fragrance. Valentino Uomo Born In Roma Coral Fantasy was launched in 2022. Valentino Uomo Born In Roma Coral Fantasy was created by Nicolas Beaulieu and Jean-Christophe Hérault. Top notes are Red Apple, Cardamom and Calabrian bergamot; middle notes are Lavender, Bourbon Geranium and Clary Sage; base notes are Tobacco Leaf, Patchouli and Haitian Vetiver.",https://www.fragrantica.com/perfume/Valentino/Valentino-Uomo-Born-In-Roma-Coral-Fantasy-71761.html,https://fimgs.net/mdimg/perfume/375x500.71761.jpg,71761
67922,GRL PWR Toni Gard for women,toni gard perfumes and colognes,"['Orange', 'Peony', 'Lemon', 'Cedar', 'Freesia', 'White Rose', 'Marshmallow', 'Musk', 'Vetiver']","GRL PWR by Toni Gard is a Floral Woody Musk fragrance for women. GRL PWR was launched in 2018. Top notes are Orange, Peony and Lemon; middle notes are Cedar, Freesia and White Rose; base notes are Marshmallow, Musk and Vetiver.",https://www.fragrantica.com/perfume/Toni-Gard/GRL-PWR-50596.html,https://fimgs.net/mdimg/perfume/375x500.50596.jpg,50596
23889,Uomo Professor for women and men,professor perfumes and colognes,"['Lavender', 'Brandy', 'Cardamom', 'Rose Petals', 'Tonka Bean', 'Coumarin', 'Vetiver', 'Sandalwood', 'Cedar', 'Benzoin', 'Amber', 'Guaiac Wood', 'Patchouli', 'Moss']","Uomo by Professor is a fragrance for women and men. Uomo was launched in 2021. The nose behind this fragrance is Moellhausen. Top notes are Lavender, Brandy, Cardamom and Rose Petals; middle notes are Tonka Bean, Coumarin, Vetiver, Sandalwood and Cedar; base notes are Benzoin, Amber, Guaiac Wood, Patchouli and Moss.",https://www.fragrantica.com/perfume/Professor/Uomo-70599.html,https://fimgs.net/mdimg/perfume/375x500.70599.jpg,70599
6277,Love Santa Lucia for women and men,santa lucia perfumes and colognes,"['Blood Grapefruit', 'Rose Oil', 'Smoke', 'Sandalwood']",Love by Santa Lucia is a Floral fragrance for women and men. This is a new fragrance. Love was launched in 2022. The nose behind this fragrance is Cristiano Canali.,https://www.fragrantica.com/perfume/Santa-Lucia/Love-72981.html,https://fimgs.net/mdimg/perfume/375x500.72981.jpg,72981
27323,Be The Wild Legend Oriflame for men,oriflame perfumes and colognes,"['Blood Orange', 'Ginger', 'Black Pepper', 'Lavender', 'Iris', 'Geranium', 'Tonka Bean', 'Vetiver', 'Ambergris']","Be The Wild Legend by Oriflame is a Amber Spicy fragrance for men. Be The Wild Legend was launched in 2019. Top notes are Blood Orange, Ginger and Black Pepper; middle notes are Lavender, Iris and Geranium; base notes are Tonka Bean, Vetiver and Ambergris.",https://www.fragrantica.com/perfume/Oriflame/Be-The-Wild-Legend-59701.html,https://fimgs.net/mdimg/perfume/375x500.59701.jpg,59701
21149,Distinct Aqua Louis Varel for men,louis varel perfumes and colognes,"['Violet Leaf', 'Grapefruit', 'Woody Notes', 'Violet', 'Palisander Rosewood', 'Sea Notes', 'Amberwood', 'Ambergris', 'Tobacco', 'Sandalwood', 'Cedar']","Distinct Aqua by Louis Varel is a Citrus fragrance for men. Distinct Aqua was launched in 2019. Top notes are Violet Leaf and Grapefruit; middle notes are Woody Notes, Violet, Palisander Rosewood and Sea Notes; base notes are Amberwood, Ambergris, Tobacco, Sandalwood and Cedar.",https://www.fragrantica.com/perfume/Louis-Varel/Distinct-Aqua-58249.html,https://fimgs.net/mdimg/perfume/375x500.58249.jpg,58249
12667,Caminho das Águas Águas de Jeri Jequiti for women,jequiti perfumes and colognes,"['Bergamot', 'Pink Pepper']",Caminho das Águas Águas de Jeri by Jequiti is a Aromatic fragrance for women. Caminho das Águas Águas de Jeri was launched in 2018.,https://www.fragrantica.com/perfume/Jequiti/Caminho-das-Aguas-Aguas-de-Jeri-75744.html,https://fimgs.net/mdimg/perfume/375x500.75744.jpg,75744
51243,Spring (Побег) Mazhu Kozhu (Мажу Кожу) for women,mazhu kozhu (мажу кожу) perfumes and colognes,"['Melon', 'Litchi', 'Marigold', 'Sundew', 'Passion Flower', 'Ho Wood', 'Oakmoss']","Spring (Побег) by Mazhu Kozhu (Мажу Кожу) is a fragrance for women. Spring (Побег) was launched in 2013. The nose behind this fragrance is Alexandra Gluck. Top notes are Melon, Litchi and Marigold; middle notes are Sundew and Passion Flower; base notes are Ho Wood and Oakmoss.",https://www.fragrantica.com/perfume/Mazhu-Kozhu-Mazu-Kozu/Spring-Pobeg-53836.html,https://fimgs.net/mdimg/perfume/375x500.53836.jpg,53836
71446,simply the best for women Mullium for women,mullium perfumes and colognes,"['Pineapple', 'Peach', 'Rose', 'Vanilla', 'Plum', 'Orchid', 'Jasmine', 'Iris', 'Amber', 'Sandalwood', 'Benzoin']",simply the best for women by Mullium is a Chypre Fruity fragrance for women. simply the best for women was launched in 2021.,https://www.fragrantica.com/perfume/Mullium/simply-the-best-for-women-68318.html,https://fimgs.net/mdimg/perfume/375x500.68318.jpg,68318
60805,Sandal Amber Parfums Vintage for women and men,parfums vintage perfumes and colognes,"['Incense', 'Amber', 'Sandalwood', 'Olibanum', 'Labdanum', 'Patchouli', 'Vanilla']","Sandal Amber by Parfums Vintage is a Amber Woody fragrance for women and men. Sandal Amber was launched in 2019. The nose behind this fragrance is Damien Stammers. Top note is Incense; middle notes are Amber, Sandalwood and Olibanum; base notes are Labdanum, Patchouli and Vanilla.",https://www.fragrantica.com/perfume/Parfums-Vintage/Sandal-Amber-53456.html,https://fimgs.net/mdimg/perfume/375x500.53456.jpg,53456
36965,Supernatural Alkemia Perfumes for women and men,alkemia perfumes perfumes and colognes,"['Musk', 'Iso E Super', 'Ambroxan']",Supernatural by Alkemia Perfumes is a fragrance for women and men. Supernatural was launched in 2019. The nose behind this fragrance is Sharra Lamoureaux.,https://www.fragrantica.com/perfume/Alkemia-Perfumes/Supernatural-57619.html,https://fimgs.net/mdimg/perfume/375x500.57619.jpg,57619
41812,Sex & Cigarettes Persons Of Interests for women and men,persons of interests perfumes and colognes,"['Bergamot', 'Lemon', 'Tobacco', 'Nutmeg', 'Cedar']",Sex & Cigarettes by Persons Of Interests is a Woody Spicy fragrance for women and men. Sex & Cigarettes was launched in 2019. Top notes are Bergamot and Lemon; middle notes are Tobacco and Nutmeg; base note is Cedar.,https://www.fragrantica.com/perfume/Persons-Of-Interests/Sex-Cigarettes-61556.html,https://fimgs.net/mdimg/perfume/375x500.61556.jpg,61556
23466,Caramel Orchid KKW Fragrance for women and men,kkw fragrance perfumes and colognes,"['Caramel', 'Cacao', 'Davana', 'Salt', 'Heliotrope', 'Jasmine', 'Ylang-Ylang', 'Vanilla', 'Cashmere Wood', 'Musk']","Caramel Orchid by KKW Fragrance is a Floral Woody Musk fragrance for women and men. This is a new fragrance. Caramel Orchid was launched in 2022. Top notes are Caramel, Cacao, Davana and Salt; middle notes are Heliotrope, Jasmine and Ylang-Ylang; base notes are Vanilla, Cashmere Wood and Musk.",https://www.fragrantica.com/perfume/KKW-Fragrance/Caramel-Orchid-71739.html,https://fimgs.net/mdimg/perfume/375x500.71739.jpg,71739
50969,Absolute Chypre 绝对素心兰 RE CLASSIFIED RE调香室 for women and men,re classified re调香室 perfumes and colognes,"['Orange Blossom', 'Mandarin Orange', 'Tangerine', 'Bergamot', 'Jasmine', 'Mimosa', 'Turkish Rose', 'Ylang-Ylang', 'Tonka Bean', 'Patchouli', 'Myrrh', 'Vetiver', 'White Musk']","Absolute Chypre 绝对素心兰 by RE CLASSIFIED RE调香室 is a Chypre fragrance for women and men. Absolute Chypre 绝对素心兰 was launched in 2015. Top notes are Orange Blossom, Mandarin Orange, Tangerine and Bergamot; middle notes are Jasmine, Mimosa, Turkish Rose and Ylang-Ylang; base notes are Tonka Bean, Patchouli, Myrrh, Vetiver and White Musk.",https://www.fragrantica.com/perfume/RE-CLASSIFIED-RE-diao-xiang-shi/Absolute-Chypre-jue-dui-su-xin-lan-33423.html,https://fimgs.net/mdimg/perfume/375x500.33423.jpg,33423
24248,Individual Blue Sunset Avon for men,avon perfumes and colognes,"['Bergamot', 'Sea Notes', 'Green Apple', 'Solar Notes', 'Cardamom', 'Lavender', 'Musk', 'Driftwood', 'Liquidambar']","Individual Blue Sunset by Avon is a Aromatic Aquatic fragrance for men. Individual Blue Sunset was launched in 2019. Top notes are Bergamot, Sea Notes and Green Apple; middle notes are Solar Notes, Cardamom and Lavender; base notes are Musk, Driftwood and Liquidambar.",https://www.fragrantica.com/perfume/Avon/Individual-Blue-Sunset-56756.html,https://fimgs.net/mdimg/perfume/375x500.56756.jpg,56756
3126,BALR. Reflect BALR. for men,balr. perfumes and colognes,"['Grapefruit', 'Violet', 'Violet', 'Palisander Rosewood', 'Amberwood', 'Amber', 'Cedar']","BALR. Reflect by BALR. is a Woody Aquatic fragrance for men. BALR. Reflect was launched in 2021. The nose behind this fragrance is Thomas Obroki. Top notes are Grapefruit and Violet; middle notes are Violet and Palisander Rosewood; base notes are Amberwood, Amber and Cedar.",https://www.fragrantica.com/perfume/BALR/BALR-Reflect-71420.html,https://fimgs.net/mdimg/perfume/375x500.71420.jpg,71420
12676,Aqua Vallis M.E.C - My Exclusive Collection for women and men,m.e.c - my exclusive collection perfumes and colognes,"['Yellow Mandarin', 'Rosebay Willowherb', 'Guatemalan Cardamom', 'Rose', 'Incense', 'Madagascar Pepper', 'Spanish Labdanum', 'Indonesian Patchouli Leaf', 'Musk', 'Vanilla']","Aqua Vallis by M.E.C - My Exclusive Collection is a fragrance for women and men. Aqua Vallis was launched in 2017. The nose behind this fragrance is Jean-Paul Guerlain. Top notes are Yellow Mandarin, Rosebay Willowherb and Guatemalan Cardamom; middle notes are Rose, Incense and Madagascar Pepper; base notes are Spanish Labdanum, Indonesian Patchouli Leaf, Musk and Vanilla.",https://www.fragrantica.com/perfume/M-E-C-My-Exclusive-Collection/Aqua-Vallis-52299.html,https://fimgs.net/mdimg/perfume/375x500.52299.jpg,52299
53703,Sapphire Orientica for women and men,orientica perfumes and colognes,"['Heliotrope', 'Cumin', 'Bergamot', 'Bitter Almond', 'Lavender', 'Jasmine', 'Vanilla', 'Amber', 'Sandalwood']","Sapphire by Orientica is a Amber Floral fragrance for women and men. Sapphire was launched in 2018. Top notes are Heliotrope, Cumin and Bergamot; middle notes are Bitter Almond, Lavender and Jasmine; base notes are Vanilla, Amber and Sandalwood.",https://www.fragrantica.com/perfume/Orientica/Sapphire-55921.html,https://fimgs.net/mdimg/perfume/375x500.55921.jpg,55921
11358,Temptation Victoria's Secret for women,victoria's secret perfumes and colognes,"['Apple', 'Floral Notes', 'Cactus Flower']",Temptation by Victoria's Secret is a Floral Fruity Gourmand fragrance for women. Temptation was launched during the 2010's.,https://www.fragrantica.com/perfume/Victoria-s-Secret/Temptation-42993.html,https://fimgs.net/mdimg/perfume/375x500.42993.jpg,42993
45316,Infinite Night Moscow By Shaik for women and men,by shaik perfumes and colognes,"['Ylang-Ylang', 'Bergamot', 'Apple Blossom', 'Pink Pepper', 'Orange Blossom', 'Orris', 'Violet', 'Rhubarb', 'Sandalwood', 'Cashmere Wood', 'Lily', 'Mango']","Infinite Night Moscow by By Shaik is a Floral fragrance for women and men. Infinite Night Moscow was launched in 2018. Top notes are Ylang-Ylang, Bergamot, Apple Blossom and Pink Pepper; middle notes are Orange Blossom, Orris, Violet and Rhubarb; base notes are Sandalwood, Cashmere Wood, Lily and Mango.",https://www.fragrantica.com/perfume/By-Shaik/Infinite-Night-Moscow-53788.html,https://fimgs.net/mdimg/perfume/375x500.53788.jpg,53788
74932,White Temple MCMC Fragrances for women and men,mcmc fragrances perfumes and colognes,"['Incense', 'Oak', 'Gurjan balsam', 'Cedar']",White Temple by MCMC Fragrances is a Woody Spicy fragrance for women and men. White Temple was launched in 2018. The nose behind this fragrance is Anne McClain.,https://www.fragrantica.com/perfume/MCMC-Fragrances/White-Temple-51711.html,https://fimgs.net/mdimg/perfume/375x500.51711.jpg,51711
18164,Blue Candy Zara for women,zara perfumes and colognes,"['Peach', 'Praline', 'Tonka Bean']",Blue Candy by Zara is a Amber Vanilla fragrance for women. Blue Candy was launched in 2019. Top note is Peach; middle note is Praline; base note is Tonka Bean.,https://www.fragrantica.com/perfume/Zara/Blue-Candy-53993.html,https://fimgs.net/mdimg/perfume/375x500.53993.jpg,53993
1814,Bleu Ambrée DSH Perfumes for women and men,dsh perfumes perfumes and colognes,"['Ambergris', 'Bourbon Vanilla', 'Amber', 'Siam Benzoin', 'Tolu Balsam', 'Bulgarian Rose', 'Damask Rose', 'Natural Musk', 'Peru Balsam', 'Ambrette (Musk Mallow)', 'Butter', 'Coriander', 'Jasmine', 'Labdanum', 'Mimosa', 'Sandalwood', 'Opoponax', 'Orris', 'Spices', 'Tonka Bean', 'Tunisian Neroli', 'Violet']",Bleu Ambrée by DSH Perfumes is a fragrance for women and men. Bleu Ambrée was launched in 2021. The nose behind this fragrance is Dawn Spencer Hurwitz.,https://www.fragrantica.com/perfume/DSH-Perfumes/Bleu-Ambree-71627.html,https://fimgs.net/mdimg/perfume/375x500.71627.jpg,71627
48564,Goldstone Shades Of Scents for women and men,shades of scents perfumes and colognes,"['Incense', 'Cloves', 'Leather', 'Pink Pepper', 'Rose', 'Tuberose', 'Jasmine', 'Ylang-Ylang', 'Patchouli', 'Amber', 'Sandalwood', 'Moss', 'Agarwood (Oud)', 'Labdanum']","Goldstone by Shades Of Scents is a Amber Woody fragrance for women and men. Goldstone was launched in 2019. The nose behind this fragrance is Michelle Moellhausen. Top notes are Incense, Cloves, Leather and Pink Pepper; middle notes are Rose, Tuberose, Jasmine, Ylang-Ylang and Patchouli; base notes are Amber, Sandalwood, Moss, Agarwood (Oud) and Labdanum.",https://www.fragrantica.com/perfume/Shades-Of-Scents/Goldstone-59376.html,https://fimgs.net/mdimg/perfume/375x500.59376.jpg,59376
62565,Jacinth Jonquil Prosody London for women,prosody london perfumes and colognes,"['Jasmine', 'Ylang-Ylang', 'Sandalwood', 'Hyacinth', 'Narcissus', 'Juniper Berries', 'Bergamot']",Jacinth Jonquil by Prosody London is a Floral fragrance for women. Jacinth Jonquil was launched in 2018. The nose behind this fragrance is Kershen Teo.,https://www.fragrantica.com/perfume/Prosody-London/Jacinth-Jonquil-52847.html,https://fimgs.net/mdimg/perfume/375x500.52847.jpg,52847
1985,Sacreste Laboratorio Olfattivo for women and men,laboratorio olfattivo perfumes and colognes,"['elemi', 'Labdanum', 'Cardamom', 'Saffron', 'Incense', 'Resins', 'Black Pepper', 'Cypriol Oil or Nagarmotha', 'Virginia Cedar', 'Guaiac Wood', 'Amber', 'Cashmeran', 'Musk']","Sacreste by Laboratorio Olfattivo is a fragrance for women and men. Sacreste was launched in 2018. The nose behind this fragrance is Luca Maffei. Top notes are elemi, Labdanum, Cardamom and Saffron; middle notes are Incense, Resins, Black Pepper and Cypriol Oil or Nagarmotha; base notes are Virginia Cedar, Guaiac Wood, Amber, Cashmeran and Musk.",https://www.fragrantica.com/perfume/Laboratorio-Olfattivo/Sacreste-51548.html,https://fimgs.net/mdimg/perfume/375x500.51548.jpg,51548
73538,N.128 InEstasy for women,inestasy perfumes and colognes,"['Bergamot', 'Wallflower', 'Jasmine', 'Gardenia', 'Amber', 'Incense']",N.128 by InEstasy is a fragrance for women.,https://www.fragrantica.com/perfume/InEstasy/N-128-58935.html,https://fimgs.net/mdimg/perfume/375x500.58935.jpg,58935
12567,Soleil de Minuit Ed Pinaud for women and men,ed pinaud perfumes and colognes,"['Bergamot', 'Citron', 'Petitgrain', 'Orange Blossom', 'Almond', 'Juniper', 'Cypress', 'Galbanum', 'Cedar']","Soleil de Minuit by Ed Pinaud is a fragrance for women and men. Soleil de Minuit was launched in 2018. Top notes are Bergamot, Citron and Petitgrain; middle notes are Orange Blossom, Almond and Juniper; base notes are Cypress, Galbanum and Cedar.",https://www.fragrantica.com/perfume/Ed-Pinaud/Soleil-de-Minuit-48995.html,https://fimgs.net/mdimg/perfume/375x500.48995.jpg,48995
62988,Pepper & Grapefruit Mith for women and men,mith perfumes and colognes,"['Pink Pepper', 'Mandarin Orange', 'Bergamot', 'Lemon', 'Orange Blossom', 'Fig Leaf', 'Cypress', 'Pistachio', 'Juniper Berries', 'Cedar', 'Musk']","Pepper & Grapefruit by Mith is a fragrance for women and men. Top notes are Pink Pepper, Mandarin Orange, Bergamot and Lemon; middle notes are Orange Blossom, Fig Leaf and Cypress; base notes are Pistachio, Juniper Berries, Cedar and Musk.",https://www.fragrantica.com/perfume/Mith/Pepper-Grapefruit-58086.html,https://fimgs.net/mdimg/perfume/375x500.58086.jpg,58086
63376,Sable Sarrasin Élixir Privé for men,élixir privé perfumes and colognes,"['Grapefruit', 'Pink Pepper', 'Orange', 'Shiso', 'Black Pepper', 'Hedione', 'Mineral notes', 'Benzoin', 'Vetiver', 'Cedar', 'oak moss']","Sable Sarrasin by Élixir Privé is a Woody Spicy fragrance for men. Sable Sarrasin was launched in 2021. The nose behind this fragrance is Olaf Larsen. Top notes are Grapefruit, Pink Pepper, Orange and Shiso; middle notes are Black Pepper, Hedione and Mineral notes; base notes are Benzoin, Vetiver, Cedar and oak moss.",https://www.fragrantica.com/perfume/Elixir-Prive/Sable-Sarrasin-77781.html,https://fimgs.net/mdimg/perfume/375x500.77781.jpg,77781
44657,D'Humeur a Rien L'Artisan Parfumeur for women and men,l'artisan parfumeur perfumes and colognes,"['Exotic Spices', 'Olibanum', 'Exotic Spices', 'Incense']",D'Humeur a Rien by L'Artisan Parfumeur is a Amber Spicy fragrance for women and men. D'Humeur a Rien was launched in 1994. The nose behind this fragrance is Olivia Giacobetti. Top note is Exotic Spices; middle notes are Olibanum and Exotic Spices; base note is Incense.,https://www.fragrantica.com/perfume/L-Artisan-Parfumeur/D-Humeur-a-Rien-73202.html,https://fimgs.net/mdimg/perfume/375x500.73202.jpg,73202
36025,Angel Cat Sugar Cocktail La Rive for women,la rive perfumes and colognes,"['Pineapple', 'Blackcurrant Syrup', 'Tangelo', 'Exotic Fruits', 'Jasmine', 'Peony', 'Plum', 'Ambergris', 'Vanilla', 'Musk']","Angel Cat Sugar Cocktail by La Rive is a Floral Fruity fragrance for women. Angel Cat Sugar Cocktail was launched in 2018. Top notes are Pineapple, Blackcurrant Syrup, Tangelo and Exotic Fruits; middle notes are Jasmine, Peony and Plum; base notes are Ambergris, Vanilla and Musk.",https://www.fragrantica.com/perfume/La-Rive/Angel-Cat-Sugar-Cocktail-58591.html,https://fimgs.net/mdimg/perfume/375x500.58591.jpg,58591
51061,Cubic Al Haramain Perfumes for women and men,al haramain perfumes perfumes and colognes,"['Dried Fruits', 'Iris', 'Black Currant', 'Amber', 'Jasmine', 'Orange', 'Labdanum', 'Bergamot', 'Musk', 'Woody Notes']",Cubic by Al Haramain Perfumes is a fragrance for women and men.,https://www.fragrantica.com/perfume/Al-Haramain-Perfumes/Cubic-40180.html,https://fimgs.net/mdimg/perfume/375x500.40180.jpg,40180
25457,Blu Agar Aura for women and men,agar aura perfumes and colognes,"['Thailand Oud', 'Agarwood (Oud)', 'Absinthe', 'Papyrus', 'Oakmoss', 'Vetiver', 'White Rose']",Blu by Agar Aura is a fragrance for women and men. Blu was launched in 2021. The nose behind this fragrance is Taha Syed.,https://www.fragrantica.com/perfume/Agar-Aura/Blu-69495.html,https://fimgs.net/mdimg/perfume/375x500.69495.jpg,69495
29719,Legal Salle Privée for men,salle privée perfumes and colognes,"['Absinthe', 'Grapefruit', 'Pink Pepper', 'Rosemary', 'Cinnamon', 'Sandalwood', 'Vetiver', 'Cedar']","Legal by Salle Privée is a Woody Spicy fragrance for men.  Legal was launched in 2021. Top notes are Absinthe, Grapefruit and Pink Pepper; middle notes are Rosemary and Cinnamon; base notes are Sandalwood, Vetiver and Cedar.",https://www.fragrantica.com/perfume/Salle-Privee/Legal-71464.html,https://fimgs.net/mdimg/perfume/375x500.71464.jpg,71464
12082,The Aeronauts House Of Sillage for women and men,house of sillage perfumes and colognes,"['Lavender', 'Quince', 'Lemon', 'Melon', 'Spruce', 'Geranium', 'Melon', 'Ambrette (Musk Mallow)', 'Guaiac Wood', 'Haitian Vetiver', 'Spanish Labdanum', 'Patchouli']","The Aeronauts by House Of Sillage is a fragrance for women and men. The Aeronauts was launched in 2020. Top notes are Lavender, Quince, Lemon and Melon; middle notes are Spruce, Geranium, Melon and Ambrette (Musk Mallow); base notes are Guaiac Wood, Haitian Vetiver, Spanish Labdanum and Patchouli.",https://www.fragrantica.com/perfume/House-Of-Sillage/The-Aeronauts-60041.html,https://fimgs.net/mdimg/perfume/375x500.60041.jpg,60041
42211,Nude Bouquet Zara for women,zara perfumes and colognes,"['Lotus', 'Bergamot', 'Honeysuckle', 'Heliotrope', 'Sandalwood', 'Vanilla', 'Tonka Bean']","Nude Bouquet by Zara is a Floral fragrance for women. Nude Bouquet was launched in 2016. Top notes are Lotus and Bergamot; middle notes are Honeysuckle and Heliotrope; base notes are Sandalwood, Vanilla and Tonka Bean.",https://www.fragrantica.com/perfume/Zara/Nude-Bouquet-38024.html,https://fimgs.net/mdimg/perfume/375x500.38024.jpg,38024
8230,Inibur Gothica for women and men,gothica perfumes and colognes,"['Black Currant', 'Bergamot', 'Pink Pepper', 'cannabis', 'Rose', 'Patchouli', 'Jasmine', 'Rhubarb', 'Ozonic notes', 'Incense', 'Musk', 'Civet', 'Animal notes']","Inibur by Gothica is a fragrance for women and men. This is a new fragrance. Inibur was launched in 2022. The nose behind this fragrance is Flavius Calaj. Top notes are Black Currant, Bergamot and Pink Pepper; middle notes are cannabis, Rose, Patchouli, Jasmine and Rhubarb; base notes are Ozonic notes, Incense, Musk, Civet and Animal notes.",https://www.fragrantica.com/perfume/Gothica/Inibur-73313.html,https://fimgs.net/mdimg/perfume/375x500.73313.jpg,73313
1700,Orionis Tiziana Terenzi for women and men,tiziana terenzi perfumes and colognes,"['Incense', 'Saffron', 'Ambergris', 'Amber', 'Patchouli', 'Tolu Balsam', 'Benzoin', 'Vanilla', 'Musk']","Orionis by Tiziana Terenzi is a Amber fragrance for women and men. Orionis was launched in 2019. The nose behind this fragrance is Paolo Terenzi. Top notes are Incense and Saffron; middle notes are Ambergris, Amber and Patchouli; base notes are Tolu Balsam, Benzoin, Vanilla and Musk.",https://www.fragrantica.com/perfume/Tiziana-Terenzi/Orionis-55009.html,https://fimgs.net/mdimg/perfume/375x500.55009.jpg,55009
47815,Peacock Throne Thameen for women and men,thameen perfumes and colognes,"['Orris', 'Indian Jasmine', 'Pink Pepper', 'Taif Rose', 'Patchouli', 'Vanilla', 'Vetiver']","Peacock Throne by Thameen is a fragrance for women and men. Peacock Throne was launched in 2018. Top notes are Orris, Indian Jasmine and Pink Pepper; middle note is Taif Rose; base notes are Patchouli, Vanilla and Vetiver.",https://www.fragrantica.com/perfume/Thameen/Peacock-Throne-49691.html,https://fimgs.net/mdimg/perfume/375x500.49691.jpg,49691
76548,Sintra Memo Paris for women and men,memo paris perfumes and colognes,"['Neroli', 'Petitgrain', 'Red Fruits', 'Bergamot', 'Milk', 'Orange Blossom', 'Resins', 'Cinnamon', 'Jasmine', 'Rose', 'Marshamallow', 'Madagascar Vanilla', 'Caramel', 'Musk', 'Cedar']","Sintra by Memo Paris is a Amber Floral fragrance for women and men. Sintra was launched in 2020. The nose behind this fragrance is Philippe Paparella-Paris. Top notes are Neroli, Petitgrain, Red Fruits and Bergamot; middle notes are Milk, Orange Blossom, Resins, Cinnamon, Jasmine and Rose; base notes are Marshamallow, Madagascar Vanilla, Caramel, Musk and Cedar.",https://www.fragrantica.com/perfume/Memo-Paris/Sintra-62837.html,https://fimgs.net/mdimg/perfume/375x500.62837.jpg,62837
75804,Iris Bloom Habibi NY for women,habibi ny perfumes and colognes,"['Agarwood (Oud)', 'Mandarin Orange', 'Black Currant', 'elemi', 'Orange Blossom', 'Iris', 'Jasmine', 'Gurjan balsam', 'Patchouli', 'Sandalwood', 'Saffron']","Iris Bloom by Habibi NY is a Floral fragrance for women. Iris Bloom was launched in 2021. The nose behind this fragrance is Guillaume Flavigny. Top notes are Agarwood (Oud), Mandarin Orange, Black Currant and elemi; middle notes are Orange Blossom, Iris, Jasmine and Gurjan balsam; base notes are Patchouli, Sandalwood and Saffron.",https://www.fragrantica.com/perfume/Habibi-NY/Iris-Bloom-68798.html,https://fimgs.net/mdimg/perfume/375x500.68798.jpg,68798
24071,Oriento Jeroboam for women and men,jeroboam perfumes and colognes,"['Saffron', 'Styrax', 'Lemon', 'Rose', 'Apple', 'Ylang-Ylang', 'Patchouli', 'Sandalwood', 'White Musk']","Oriento by Jeroboam is a Amber fragrance for women and men. Oriento was launched in 2015. The nose behind this fragrance is Vanina Muracciole. Top notes are Saffron, Styrax and Lemon; middle notes are Rose, Apple and Ylang-Ylang; base notes are Patchouli, Sandalwood and White Musk.",https://www.fragrantica.com/perfume/Jeroboam/Oriento-32420.html,https://fimgs.net/mdimg/perfume/375x500.32420.jpg,32420
